"DealerID","DealerName","IsNew","VIN","Stock","Year","Make","Model","Trim","BodyStyle","BodyType","FactoryCertified","DealerCertified","ModelCode","ListPrice","SpecialPrice","CostPrice","ExtraPrice1","ExtraPrice2","Mileage","ChromeStyleID","FuelType","Exteriorcolor","Exteriorcolorcode","Interiorcolor","Interiorcolorcode","Interiormaterial","Wheelbase","DoorCount","EngineDisplacement","Cylinders","Drivetrain","Transmission","TransmissionSpeed","OptionDescription","OptionCodes","PhotoURL","PhotoTimestamp","DealerComments","InstockDate","LastModifiedDate","VideoURL","CityMPG","HwyMPG","ExtraField1","ExtraField2","ExtraField3","VehicleID","Address1","City","State","Zip","Dealer Phone","Dealer Email"
"451730","Premium Motors LLC","0","1VWAP7A32DC134429","11683","2013","Volkswagen","Passat","S PZEV","Car","","0","0","","6990","","","","","127747","","gas","Silver","","Black","","Cloth","","4","2.5","5","fwd","6-Speed Shiftable Automatic","","Bluetooth,Driver seat manual adjustments:   height, lumbar,Front headrests: adjustable  2,Front seat type: bucket,Passenger seat manual adjustments:   height,Rear headrests: adjustable  3,Rear seat folding: split,Rear seat type: 60-40 split bench,Upholstery: cloth,ABS: 4-wheel,Braking assist: ,Electronic brakeforce distribution: ,Front brake diameter: 12.3,Front brake type: ventilated disc,Front brake width: 1.0,Power brakes: ,Rear brake diameter: 10.7,Rear brake type: disc,Rear brake width: 0.4,Alternator: 140 amps,Daytime running lights: ,Headlights: auto on/off  halogen,Taillights: LED,Active head restraints: dual front,Automatic hazard warning lights: ,Child safety door locks: ,Child seat anchors: LATCH system,Crumple zones: front  rear,Emergency interior trunk release: ,Impact sensor: door unlock  fuel cut-off, post-collision safety system,Safety brake pedal system: ,Airbag deactivation: occupant sensing passenger,Front airbags: dual,Side airbags: front,Side curtain airbags: front  rear,Side mirror adjustments: manual folding  power,Side mirrors: integrated turn signals,Front wipers: variable intermittent,Power windows: safety reverse,Window defogger: rear,Anti-theft system: alarm  vehicle immobilizer,Power door locks: auto-locking,Steering ratio: 16.4,Turns lock-to-lock: 3.0,Emergency locking retractors: front  rear,Front seatbelts: 3-point,Rear seatbelts: 3-point,Seatbelt force limiters: front  rear,Seatbelt pretensioners: front,Seatbelt warning sensor: front,Axle ratio: 3.87,Front shock type: gas,Front spring type: coil,Front stabilizer bar: ,Front struts: MacPherson,Front suspension classification: independent,Front suspension type: lower control arms,Rear shock type: gas,Rear spring type: coil,Rear stabilizer bar: ,Rear suspension classification: independent,Rear suspension type: multi-link,Wireless data link: Bluetooth,Antenna type: diversity  mast,Auxiliary audio input: Bluetooth  jack,In-Dash CD: MP3 Playback  single disc,Radio: AM/FM,Total speakers: 6,Spare tire mount location: inside,Spare tire size: temporary,Spare wheel type: steel,Tire Pressure Monitoring System: ,Tire type: all season,Wheels: steel,Clock: ,Digital odometer: ,External temperature display: ,Fuel economy display: MPG  range,Gauge: tachometer,Multi-function display: ,Trip odometer: ,Warnings and reminders: low fuel level  turn off headlights,Air filtration: ,Front air conditioning: ,Front air conditioning zones: single,Armrests: front center,Dash trim: metallic,Door trim: cloth,Interior accents: metallic-tone,Body side moldings: body-color,Door handle color: body-color,Front bumper color: body-color,Grille color: chrome,Mirror color: body-color,Rear bumper color: body-color,Window trim: black,Assist handle: front  rear,Center console: front console with storage,Cruise control: ,Cupholders: front  rear,Multi-function remote: keyless entry  panic alarm, trunk release,One-touch windows: 2,Power outlet(s): 12V cargo area  12V front, 12V rear,Power steering: ,Power windows: lockout button,Push-button start: ,Reading lights: front,Rearview mirror: manual day/night,Steering wheel: tilt and telescopic,Steering wheel mounted controls: audio  cruise control, phone,Storage: cargo tie-down anchors and hooks  door pockets, front seatback,Vanity mirrors: dual,Stability control: ,Traction control: ","","https://cdn.dealrimages.com/DC%2FOV%2FB2%2FOV8Y3PDK033S0A.jpg?h=800,https://cdn.dealrimages.com/AM%2FBM%2F1W%2F99Y24AL5EI6BTG.jpg?h=800,https://cdn.dealrimages.com/I8%2F44%2FBQ%2F7UHNDJ4Z6WHH5E.jpg?h=800,https://cdn.dealrimages.com/6F%2FO7%2FJZ%2FG077HXK4Q38Q0Z.jpg?h=800,https://cdn.dealrimages.com/VU%2FZM%2FPZ%2FRQPN1PCYQRBX1L.jpg?h=800,https://cdn.dealrimages.com/7J%2FO7%2F1W%2FEF6FG0PKZ44UXO.jpg?h=800,https://cdn.dealrimages.com/B0%2FQJ%2FTG%2FCQV1T4P3WII6DX.jpg?h=800,https://cdn.dealrimages.com/N3%2F11%2FYV%2FMLLEX6AKEY3X0W.jpg?h=800,https://cdn.dealrimages.com/XO%2F6Q%2FGG%2FND13YC1N8EWJ7M.jpg?h=800,https://cdn.dealrimages.com/EB%2FMM%2FSM%2FSJOKMDYMXF2QF6.jpg?h=800,https://cdn.dealrimages.com/Y1%2FKW%2FWW%2FY7KMBYI8FISOO4.jpg?h=800,https://cdn.dealrimages.com/EI%2F9O%2FIW%2FQI5CNG783SOD1G.jpg?h=800,https://cdn.dealrimages.com/DN%2FIO%2FV4%2F17Y7HSJQFMI92B.jpg?h=800,https://cdn.dealrimages.com/GO%2FYS%2FLB%2FH9OSDS9FEU8YNF.jpg?h=800,https://cdn.dealrimages.com/9N%2F12%2FOH%2FG0I7QA12STT9F8.jpg?h=800,https://cdn.dealrimages.com/NN%2FGZ%2F9F%2FZQPWO4IR7W12BJ.jpg?h=800,https://cdn.dealrimages.com/LJ%2F2S%2FAK%2FPYA4348ARCFGIF.jpg?h=800,https://cdn.dealrimages.com/JJ%2FL3%2FPX%2FFJWB4424ATYOQC.jpg?h=800,https://cdn.dealrimages.com/M3%2FHE%2FWR%2FL4ONZBVT3UDI4H.jpg?h=800,https://cdn.dealrimages.com/E6%2F3G%2FY4%2FYYV3B31XF2LRXE.jpg?h=800,https://cdn.dealrimages.com/5G%2F04%2F9T%2F0ZXQC1D4X7T1UR.jpg?h=800,https://cdn.dealrimages.com/JC%2FXG%2FCP%2FMIGKT29LICE1HU.jpg?h=800,https://cdn.dealrimages.com/Z8%2FRZ%2F59%2FIGDKI6KRR6SLI7.jpg?h=800,https://cdn.dealrimages.com/TU%2FM8%2FGC%2FXR1EO0UZNDRFWZ.jpg?h=800,https://cdn.dealrimages.com/DL%2FPJ%2F7B%2F74ZU1KCXGYO2AD.jpg?h=800,https://cdn.dealrimages.com/LT%2FXV%2FRI%2FRSGLPG97TXWEL1.jpg?h=800,https://cdn.dealrimages.com/ZL%2FDD%2F9W%2FQXGC5EFZOHBNOR.jpg?h=800","1970-01-01T00:00:00+00:00","","2024-04-30","","","22","","https://www.premiummotors.com//viewInventory/749048/","","","749048","14778 E Broad St.","Reynoldsburg","OH","43068","(614) 412-3429","sales@premiummotors.com"
"451730","Premium Motors LLC","0","1V2LR2CA4JC506318","11688","2018","Volkswagen","Atlas","V6 SE 4Motion","SUV","","0","0","","14490","","","","","116052","","gas","Black","","Black","","Leather","","4","3.6","6","awd","8-Speed Automatic with Tiptronic","","Remote Start,Leather Seats,Heated Seats,Bluetooth,Backup Camera,Roof rails: silver,Driver seat: heated,Driver seat power adjustments: height  lumbar, reclining, 10,Front headrests: adjustable  2,Front seat type: bucket,Passenger seat: heated,Passenger seat manual adjustments: reclining  4,Rear headrests: adjustable  3,Rear seat folding: flat  split,Rear seat manual adjustments: reclining,Rear seat type: 60-40 split bench,Third row headrests: adjustable  2,Third row seat folding: flat  split,Third row seat type: 50-50 split bench,Upholstery: leatherette,ABS: 4-wheel,Braking assist: ,Electronic brakeforce distribution: ,Electronic parking brake: auto off,Front brake diameter: 13.2,Front brake type: ventilated disc,Front brake width: 1.2,Power brakes: ,Rear brake diameter: 12.2,Rear brake type: ventilated disc,Rear brake width: 0.9,Auto start/stop: ,Battery: maintenance-free,Battery saver: ,Daytime running lights: LED,Exterior entry lights: approach lamps  puddle lamps,Front fog lights: cornering,Headlights: LED  auto delay off, auto on/off,Automatic emergency braking: front  rear,Automatic hazard warning lights: ,Blind spot safety: sensor/alert,Camera system: rearview,Child safety door locks: ,Child seat anchors: LATCH system,Cross traffic alert: rear,Crumple zones: front  rear,Impact sensor: door unlock  fuel cut-off, post-collision safety system,Lane deviation sensors: ,Pre-collision warning system: audible warning  visual warning,Rearview monitor: in dash,Safety brake pedal system: ,Airbag deactivation: occupant sensing passenger,Front airbags: dual,Side airbags: front,Side curtain airbags: front  rear, third row,Side mirror adjustments: manual folding  power,Side mirrors: heated  integrated turn signals,Front wipers: rain sensing  variable intermittent,Heated windshield washer jets: ,Liftgate window: fixed,Power windows: remotely operated  safety reverse,Rear privacy glass: ,Rear wiper: intermittent,Window defogger: rear,Anti-theft system: alarm  vehicle immobilizer,Power door locks: auto-locking,Steering ratio: 16.3,Turns lock-to-lock: 2.8,Emergency locking retractors: front  rear, third row,Front seatbelts: 3-point,Rear seatbelts: 3-point,Seatbelt pretensioners: front  rear,Seatbelt warning sensor: front,Third row seatbelts: 3-point,4WD type: full time,Axle ratio: 3.60,Front shock type: gas,Front spring type: coil,Front stabilizer bar: ,Front struts: MacPherson,Front suspension classification: independent,Front suspension type: lower control arms,Rear shock type: gas,Rear spring type: coil,Rear stabilizer bar: ,Rear suspension classification: independent,Rear suspension type: multi-link,Driver assistance app: roadside assistance,Electronic messaging assistance: voice operated,Smart device app compatibility: Car-Net,Smart device app function: horn/light operation  lock operation, maintenance status,Wireless data link: Bluetooth,Antenna type: diversity  mast,Auxiliary audio input: Bluetooth  USB, iPod/iPhone, jack, memory card slot,In-Dash CD: MP3 Playback  single disc,Radio: AM/FM  HD radio, touch screen display, voice operated,Radio data system: ,Satellite radio: SiriusXM,Total speakers: 8,Spare tire mount location: inside,Spare tire size: temporary,Spare wheel type: steel,Tire Pressure Monitoring System: ,Tire type: all season,Wheels: aluminum alloy,Clock: ,Compass: ,Digital odometer: ,External temperature display: ,Fuel economy display: MPG  range,Gauge: tachometer,Multi-function display: ,Trip odometer: ,Warnings and reminders: coolant temperature warning  lamp failure, low fuel level, low oil pressure, maintenance due,Air filtration: ,Front air conditioning: automatic climate control,Front air conditioning zones: dual,Rear air conditioning: automatic climate control  independently controlled,Rear air conditioning zones: single,Rear vents: third row,Armrests: rear center with cupholders  rear folding,Floor mat material: carpet,Floor material: carpet,Floor mats: front  rear,Interior accents: metallic/woodgrain,Shift knob trim: leather,Steering wheel trim: leather,Door handle color: body-color,Exhaust: dual tip,Exhaust tip color: chrome,Front bumper color: body-color,Grille color: chrome,Mirror color: body-color,Rear bumper color: body-color,Rear trunk/liftgate: liftgate  power operated,Window trim: chrome,Trailer wiring: ,Adaptive cruise control: ,Adaptive stop and go cruise control: semi-automatic,Assist handle: front  rear,Cargo area light: ,Center console: front console with armrest and storage,Cupholders: front  rear, third row,Easy entry: manual rear seat,Footwell lights: ,Memorized settings: 3 driver  driver seat,Multi-function remote: panic alarm  proximity entry system, trunk release,One-touch windows: 4,Power outlet(s): 12V cargo area  12V front, 12V rear,Power steering: variable/speed-proportional,Power windows: lockout button,Push-button start: ,Reading lights: front  rear, third row,Rearview mirror: auto-dimming,Remote engine start: ,Steering wheel: tilt and telescopic,Steering wheel mounted controls: audio  cruise control, multi-function, phone, voice control,Storage: cargo tie-down anchors and hooks  cooled compartment, door pockets, front seatback,Sunshade: side window,Vanity mirrors: dual illuminating,Connected in-car apps: app marketplace integration,Infotainment screen size: 8 in.,Smartphone integration: Android Auto  Apple CarPlay,Hill holder control: ,Off-road driving assist: hill descent,Roll stability control: ,Stability control: ,Traction control: ,Trailer stability control: ","","https://cdn.dealrimages.com/OG%2FPX%2FB7%2F78K1GDAQA8BDNU.jpg?h=800,https://cdn.dealrimages.com/BT%2FT9%2FUG%2F16NGTKY7TPDJHL.jpg?h=800,https://cdn.dealrimages.com/V0%2FJR%2FYM%2FHCQCHD2U4J68NF.jpg?h=800,https://cdn.dealrimages.com/0Q%2FK4%2FR2%2FK4JXUPPER5AO6D.jpg?h=800,https://cdn.dealrimages.com/Y0%2FB2%2FV7%2FCJUWXU6G3UBT4C.jpg?h=800,https://cdn.dealrimages.com/EL%2FQ6%2F3P%2FX4FWC304M3PTG8.jpg?h=800,https://cdn.dealrimages.com/TP%2F1F%2F2I%2FSBWX8HU1ICK1W5.jpg?h=800,https://cdn.dealrimages.com/GD%2FMY%2FIB%2F4QI6OUGPVZSXVJ.jpg?h=800,https://cdn.dealrimages.com/0H%2F8A%2F8I%2FRYBV7350OEBD50.jpg?h=800,https://cdn.dealrimages.com/KE%2F0Z%2FP0%2FUWC0SYEJ0P9BON.jpg?h=800,https://cdn.dealrimages.com/QI%2FGO%2F1O%2FHRI50OUQPFTKNU.jpg?h=800,https://cdn.dealrimages.com/28%2F1L%2FLS%2F9SYB89RZFHDKQ7.jpg?h=800,https://cdn.dealrimages.com/O0%2FXF%2FV6%2F8NTHSVOFM67MB5.jpg?h=800,https://cdn.dealrimages.com/BC%2FG5%2FFA%2FYD5NPT4K45KZZQ.jpg?h=800,https://cdn.dealrimages.com/WW%2FEC%2FGU%2F5PDWKTD6AYPR47.jpg?h=800,https://cdn.dealrimages.com/YZ%2F4Z%2FRC%2F434UOTASRIVN97.jpg?h=800,https://cdn.dealrimages.com/3I%2FSU%2F4G%2F68W2JT3LU5ZZMM.jpg?h=800,https://cdn.dealrimages.com/P6%2FYD%2FFS%2FUKAGGOFFZI5F5K.jpg?h=800,https://cdn.dealrimages.com/5Z%2FS9%2FHT%2FDPCYB89ZH2408W.jpg?h=800,https://cdn.dealrimages.com/58%2F3O%2FZ9%2FVNJ8IC5SS2QMNP.jpg?h=800,https://cdn.dealrimages.com/LV%2FNV%2F4B%2FO4OQPOZU270F1J.jpg?h=800,https://cdn.dealrimages.com/AY%2FS4%2F4C%2FQODW79B6XAYP9E.jpg?h=800,https://cdn.dealrimages.com/D8%2F52%2F6E%2FCPCVUS8I0EAN32.jpg?h=800,https://cdn.dealrimages.com/LA%2FDV%2F2P%2F6QG39WGSHA5C0X.jpg?h=800,https://cdn.dealrimages.com/A5%2FUI%2FG1%2FT9IKQGOLJWXID1.jpg?h=800,https://cdn.dealrimages.com/1F%2FOQ%2FY5%2FZ1SQ1N32UL8UON.jpg?h=800,https://cdn.dealrimages.com/IO%2FYN%2F1G%2FER0WDUWEU8NWAR.jpg?h=800,https://cdn.dealrimages.com/P9%2FAP%2F8S%2FWNOHC8L0HBC79N.jpg?h=800,https://cdn.dealrimages.com/Y1%2FX8%2FG3%2FI97PPR3HIWVDCB.jpg?h=800,https://cdn.dealrimages.com/4H%2FAV%2F6H%2FEHM7U0HKPWOW3R.jpg?h=800,https://cdn.dealrimages.com/X5%2FKW%2F6X%2F27XWW2QF1YRZUC.jpg?h=800,https://cdn.dealrimages.com/ZD%2F6X%2FNJ%2F6QM22220U6JXI3.jpg?h=800,https://cdn.dealrimages.com/IT%2FN2%2FF0%2FXWYMZUOFYM10TM.jpg?h=800,https://cdn.dealrimages.com/9L%2FFC%2FYU%2FQK8FW1OXHZWBTR.jpg?h=800,https://cdn.dealrimages.com/NF%2FGO%2FZM%2FH7IAWA89BRSY69.jpg?h=800,https://cdn.dealrimages.com/YR%2F82%2F6U%2FSLRPUENY3TI0UB.jpg?h=800,https://cdn.dealrimages.com/S4%2FBX%2F8Q%2F8HXH6EHJNH3ZS9.jpg?h=800","1970-01-01T00:00:00+00:00","","2024-05-07","","","17","","https://www.premiummotors.com//viewInventory/752047/","","","752047","14778 E Broad St.","Reynoldsburg","OH","43068","(614) 412-3429","sales@premiummotors.com"
"451730","Premium Motors LLC","0","WA1CFAFP8DA081619","11147","2013","Audi","Q5","2.0T quattro Premium","SUV","","0","0","","10490","","","","","116784","","gas","Gray","","Gray","","Leather","","4","2.0","4","awd","8-Speed Automatic with Tiptronic","","Sunroof/Moonroof,Leather Seats,Heated Seats,Bluetooth,Roof rails: silver,Liftgate window: fixed,Rear door type: power liftgate,Driver seat: heated,Driver seat power adjustments: height  lumbar, 8,Front headrests: adjustable  2,Front seat type: bucket,Passenger seat manual adjustments: lumbar,Passenger seat power adjustments: height  8,Rear headrests: adjustable  3,Rear seat folding: split,Rear seat manual adjustments: reclining,Rear seat type: 40-20-40 split bench,Upholstery: premium leather,ABS: 4-wheel,Braking assist: ,Electronic brakeforce distribution: ,Electronic parking brake: ,Front brake diameter: 12.6,Front brake type: ventilated disc,Rear brake diameter: 11.8,Rear brake type: disc,Alternator: 150 amps,Daytime running lights: LED,Exterior entry lights: approach lamps,Front fog lights: ,Headlights: auto delay off  auto on, halogen,Rear fog lights: ,Taillights: LED  rear center,Body side reinforcements: side impact door beams,Child safety door locks: ,Child seat anchors: LATCH system,Crumple zones: front  rear,Impact sensor: door unlock  fuel cut-off, post-collision safety system,Airbag deactivation: occupant sensing passenger,Front airbags: dual,Side airbags: front,Side curtain airbags: front  rear,Side mirror adjustments: power,Side mirrors: heated  integrated turn signals,Front wipers: rain sensing  variable intermittent,Heated windshield washer jets: ,Power windows: safety reverse,Rear privacy glass: ,Rear wiper: with washer,Window defogger: rear,2-stage unlocking doors: ,Anti-theft system: alarm  audio security system, engine immobilizer,Power door locks: auto-locking,Steering ratio: 15.9,Front seatbelts: 3-point,Rear seatbelts: 3-point,Seatbelt force limiters: front,Seatbelt pretensioners: front  rear,Seatbelt warning sensor: front,4WD type: full time,Axle ratio: 3.77,Center differential: mechanical,Limited slip differential: center,Locking differential: front  rear,Front shock type: gas,Front spring type: coil,Front stabilizer bar: ,Front struts: ,Front suspension classification: independent,Front suspension type: double ball joint,Rear shock type: gas,Rear spring type: coil,Rear stabilizer bar: ,Rear suspension classification: independent,Rear suspension type: multi-link,Antenna type: diversity,Auxiliary audio input: USB  iPod/iPhone, jack,In-Dash CD: MP3 Playback  single disc,Radio: AM/FM,Satellite radio: SiriusXM,Speed sensitive volume control: ,Subwoofer: 1,Surround sound: 5.1,Total speakers: 9,Watts: 180,Spare tire mount location: inside,Spare tire size: temporary,Spare wheel type: steel,Tire Pressure Monitoring System: ,Tire type: all season,Wheel spokes: 10,Wheels: alloy,Clock: ,Driver information system: ,External temperature display: ,Fuel economy display: MPG  range,Gauge: tachometer,Trip odometer: ,Warnings and reminders: coolant temperature warning  lamp failure, low fuel level, low oil pressure, tire fill alert,Air filtration: ,Front air conditioning: automatic climate control,Front air conditioning zones: dual,Rear air conditioning: automatic climate control,Rear air conditioning zones: single,Armrests: rear center folding with pass-thru,Cargo area floor mat: ,Center console trim: alloy  wood,Dash trim: alloy  wood,Door trim: alloy  wood,Floor mat material: carpet,Floor material: carpet,Floor mats: front  rear,Interior accents: aluminum  woodgrain,Shift knob trim: leather,Steering wheel trim: leather,Door handle color: body-color,Exhaust: dual tip,Exhaust tip color: polished aluminum,Front bumper color: body-color,Grille color: aluminum,Mirror color: body-color,Rear bumper color: body-color,Rear spoiler: roofline,Rear spoiler color: body-color,Window trim: silver,Trailer hitch: ready,Ambient lighting: ,Assist handle: front  rear,Cargo area light: ,Cargo cover: hard,Center console: front console with armrest,Courtesy lights: console,Cruise control: ,Cupholders: front  rear,Footwell lights: ,Multi-function remote: keyless entry  trunk release,One-touch windows: 2,Overhead console: front,Power outlet(s): 12V front  12V rear, two 12V,Power steering: variable/speed-proportional,Reading lights: front  rear,Retained accessory power: ,Steering wheel: tilt and telescopic,Steering wheel mounted controls: audio  cruise control,Storage: cargo tie-down anchors and hooks  door pockets, front seatback,Vanity mirrors: dual illuminating,Hill holder control: ,Stability control: ,Traction control: ","","https://cdn.dealrimages.com/Y4%2FLT%2FXB%2F5K6IP7VLWZOE69.jpg?h=800,https://cdn.dealrimages.com/B3%2F8G%2F4K%2F5JJB078Y6X0RVN.jpg?h=800,https://cdn.dealrimages.com/Y9%2FBB%2FG5%2FJFEM0OOFKQDGPF.jpg?h=800,https://cdn.dealrimages.com/XT%2F8H%2FTS%2FCKDFOHBMZTPE3Z.jpg?h=800,https://cdn.dealrimages.com/17%2FUE%2F7V%2FPQUMJW23QBJT7T.jpg?h=800,https://cdn.dealrimages.com/3H%2F3N%2FSH%2FR022UR7F1LSOWB.jpg?h=800,https://cdn.dealrimages.com/JP%2FE1%2FR9%2FVAUIEFNR054C2W.jpg?h=800,https://cdn.dealrimages.com/L1%2FQY%2F6B%2FANJQ2RF9UJG1JG.jpg?h=800,https://cdn.dealrimages.com/3V%2FBN%2FBS%2F1Q5633IOCJVKS9.jpg?h=800,https://cdn.dealrimages.com/ZU%2FDH%2FSB%2F1IP8EXXL34J9VD.jpg?h=800,https://cdn.dealrimages.com/GW%2F9O%2F0O%2F5DN6SUP839KA7K.jpg?h=800,https://cdn.dealrimages.com/T9%2FW0%2FVK%2FTSME6T1FXRMCLT.jpg?h=800,https://cdn.dealrimages.com/TO%2FJP%2FPA%2FTY8XQDCQLH0QD3.jpg?h=800,https://cdn.dealrimages.com/EU%2F75%2FA9%2F5JXNBXE73LY3DR.jpg?h=800,https://cdn.dealrimages.com/LY%2FZY%2FS9%2FVHM40IPA5OOCZ3.jpg?h=800,https://cdn.dealrimages.com/IW%2FCU%2FY0%2FEXH99CJWWAJRIF.jpg?h=800,https://cdn.dealrimages.com/K4%2FEN%2FXQ%2FQ23QNI43YU5HE2.jpg?h=800,https://cdn.dealrimages.com/7I%2FCD%2FYW%2FC7TJ2HYZ5QMQY1.jpg?h=800,https://cdn.dealrimages.com/VP%2FQN%2FU4%2FX6A0TT6WFFP3ZU.jpg?h=800,https://cdn.dealrimages.com/BD%2FFN%2FSR%2FS8HHNQ61RDOP2W.jpg?h=800,https://cdn.dealrimages.com/6H%2FRS%2FRA%2F03CY3B178OUA3L.jpg?h=800,https://cdn.dealrimages.com/2K%2FHL%2F56%2FR4VNRPD2HWH17Y.jpg?h=800,https://cdn.dealrimages.com/8G%2FOD%2FJ3%2F4PZ5ICHRFLPIZQ.jpg?h=800,https://cdn.dealrimages.com/V9%2FCL%2FX3%2F4YYVFFS0H53D5T.jpg?h=800,https://cdn.dealrimages.com/YO%2FSS%2FDR%2F34UUQLRXR3G7K9.jpg?h=800,https://cdn.dealrimages.com/K9%2FIX%2FYF%2F2TWNAFK9SRUMMY.jpg?h=800,https://cdn.dealrimages.com/C3%2F6T%2FT1%2FD0WTYET997YI8P.jpg?h=800,https://cdn.dealrimages.com/48%2FUR%2F7O%2FM7BH6N70BH5VUN.jpg?h=800,https://cdn.dealrimages.com/DY%2FYQ%2F1R%2F3I2GJM4C2GR9AB.jpg?h=800,https://cdn.dealrimages.com/S7%2F2L%2FYR%2F1AAZ8EFLZ6GT3E.jpg?h=800,https://cdn.dealrimages.com/CX%2FTM%2FH3%2FMGYKE1H50E7QLZ.jpg?h=800,https://cdn.dealrimages.com/I9%2F43%2FAB%2F43B4MP2PCTILZF.jpg?h=800,https://cdn.dealrimages.com/63%2FD0%2F2A%2FMT6S81WRDIGBGD.jpg?h=800,https://cdn.dealrimages.com/GL%2FGQ%2FB9%2FCCIRWNHIWRDUIU.jpg?h=800,https://cdn.dealrimages.com/UQ%2FQV%2FR8%2FYOUA5O0654SHEG.jpg?h=800,https://cdn.dealrimages.com/8U%2FOF%2FBI%2FF0C4Z1W04Q2404.jpg?h=800","1970-01-01T00:00:00+00:00","","2022-02-23","","","20","","https://www.premiummotors.com//viewInventory/492697/","","","492697","14778 E Broad St.","Reynoldsburg","OH","43068","(614) 412-3429","sales@premiummotors.com"
