"DealerID","DealerName","IsNew","VIN","Stock","Year","Make","Model","Trim","BodyStyle","BodyType","FactoryCertified","DealerCertified","ModelCode","ListPrice","SpecialPrice","CostPrice","ExtraPrice1","ExtraPrice2","Mileage","ChromeStyleID","FuelType","Exteriorcolor","Exteriorcolorcode","Interiorcolor","Interiorcolorcode","Interiormaterial","Wheelbase","DoorCount","EngineDisplacement","Cylinders","Drivetrain","Transmission","TransmissionSpeed","OptionDescription","OptionCodes","PhotoURL","PhotoTimestamp","DealerComments","InstockDate","LastModifiedDate","VideoURL","CityMPG","HwyMPG","ExtraField1","ExtraField2","ExtraField3","VehicleID","Address1","City","State","Zip","Dealer Phone","Dealer Email"
"451730","Premium Motors LLC","0","JM3TCBCY2G0109613","11829","2016","Mazda","CX-9","Touring","SUV","","0","0","","11990","","","","","134550","","gas","Gray","","Black","","Leather","","4","2.5","4","awd","6-Speed Shiftable Automatic","","Sunroof/Moonroof,Navigation System,Leather Seats,Heated Seats,Bluetooth,Backup Camera,Liftgate window: fixed,Rear door type: power liftgate,Driver seat: heated,Driver seat power adjustments: height  lumbar, reclining, 8,Front headrests: adjustable  2,Front seat type: bucket,Passenger seat: heated,Passenger seat manual adjustments: reclining,Passenger seat power adjustments: 4,Rear headrests: adjustable  3,Rear seat folding: split,Rear seat manual adjustments: reclining,Rear seat type: 60-40 split bench,Third row headrests: adjustable  2,Third row seat folding: flat  split,Third row seat type: 50-50 split bench,Third row seat upholstery: vinyl,Upholstery: leather-trimmed,ABS: 4-wheel,Braking assist: ,Electronic brakeforce distribution: ,Electronic parking brake: ,Front brake diameter: 12.6,Front brake type: ventilated disc,Power brakes: ,Rear brake diameter: 12.8,Rear brake type: disc,Alternator: 150 amps,Battery: maintenance-free,Battery saver: ,Daytime running lights: LED,Exterior entry lights: approach lamps,Headlights: LED  auto off, self-leveling,Taillights: LED,Blind spot safety: sensor/alert,Body side reinforcements: side impact door beams,Camera system: rearview,Child safety door locks: ,Child seat anchors: LATCH system,Cross traffic alert: rear,Crumple zones: front  rear,Energy absorbing steering column: ,Lane deviation sensors: ,Rearview monitor: in dash,Airbag deactivation: occupant sensing passenger,Front airbags: dual,Side airbags: front,Side curtain airbags: front  rear, third row,Side-curtain airbag rollover sensor: ,Side mirror adjustments: manual folding  power,Side mirrors: heated  integrated turn signals,Front wipers: variable intermittent,Power windows: safety reverse,Rear privacy glass: ,Rear wiper: intermittent  with washer,Window defogger: rear,2-stage unlocking doors: ,Anti-theft system: engine immobilizer,Power door locks: anti-lockout  auto-locking,Steering ratio: 17.6,Turns lock-to-lock: 3.1,Front seatbelts: 3-point,Rear seatbelts: 3-point,Seatbelt force limiters: front,Seatbelt pretensioners: front,Seatbelt warning sensor: front,Third row seatbelts: 3-point,4WD type: on demand,Axle ratio: 4.41,Drive mode selector: ,Front shock type: gas,Front spring type: coil,Front stabilizer bar: ,Front struts: MacPherson,Front suspension classification: independent,Front suspension type: lower control arms,Rear shock type: gas,Rear spring type: coil,Rear stabilizer bar: ,Rear suspension classification: independent,Rear suspension type: multi-link,Electronic messaging assistance: voice operated  with read function,Phone: hands free,Wireless data link: Bluetooth,Antenna type: mast,Auxiliary audio input: Bluetooth  USB, iPod/iPhone, jack,Internet radio app: AHA  Pandora, Stitcher,Radio: AM/FM  HD radio, touch screen display, voice operated,Radio data system: ,Speed sensitive volume control: ,Total speakers: 6,Spare tire mount location: inside,Spare tire size: temporary,Spare wheel type: steel,Tire Pressure Monitoring System: ,Tire type: all season,Wheels: aluminum alloy,Clock: ,Compass: ,Digital odometer: ,Driver information system: ,External temperature display: ,Fuel economy display: MPG  range,Gauge: tachometer,Trip odometer: ,Warnings and reminders: coolant temperature warning  lamp failure, low fuel level, low oil pressure, tire fill alert,Air filtration: ,Front air conditioning: automatic climate control,Front air conditioning zones: dual,Rear air conditioning: automatic climate control  independently controlled,Rear air conditioning zones: single,Armrests: rear center folding with storage  rear center with cupholders,Door trim: cloth,Floor mat material: carpet,Floor material: carpet,Floor mats: front  rear, third row,Shift knob trim: leather,Steering wheel trim: leather,Door handle color: body-color,Exhaust: dual tip,Exhaust tip color: metallic,Front bumper color: body-color,Grille color: chrome,Mirror color: body-color,Rear bumper color: body-color,Rear spoiler: roofline,Rear spoiler color: body-color,Rocker panel color: black,Window trim: chrome,Trailer hitch: ready,Assist handle: front  rear,Cargo area light: ,Center console: front console with armrest and storage,Courtesy lights: door,Cruise control: ,Cupholders: front  rear, third row,Easy entry: manual rear seat,Memorized settings: liftgate,Multi-function remote: panic alarm  proximity entry system, trunk release,One-touch windows: 4,Overhead console: front,Power outlet(s): 12V cargo area  12V front,Power steering: variable/speed-proportional,Power windows: lockout button,Push-button start: ,Reading lights: front  rear,Rearview mirror: auto-dimming,Retained accessory power: ,Steering wheel: tilt and telescopic,Steering wheel mounted controls: audio  cruise control, phone, voice control,Storage: accessory hook  door pockets, front seatback, in floor, organizer, sunglasses holder,Universal remote transmitter: Homelink - garage door opener,Vanity mirrors: dual illuminating,Infotainment: MAZDA CONNECT,Infotainment screen size: 8 in.,Hill holder control: ,Roll stability control: ,Stability control: ,Traction control: ","","https://cdn.dealrimages.com/GJ%2F9W%2FVX%2F1J1ZRNPWP3FDJH.jpg?h=800,https://cdn.dealrimages.com/Q9%2FEP%2F0H%2FYZFS4EKF2OJFMT.jpg?h=800,https://cdn.dealrimages.com/IO%2FQZ%2F1V%2FGZ7RWDT7DB0QB1.jpg?h=800,https://cdn.dealrimages.com/01%2FJK%2F1H%2FVHCJRQTK0PBZDL.jpg?h=800,https://cdn.dealrimages.com/NE%2FT5%2F54%2FA6IJWQL9TTLXE5.jpg?h=800,https://cdn.dealrimages.com/5Q%2F4G%2F1E%2FS0M0WCTO9HALYH.jpg?h=800,https://cdn.dealrimages.com/07%2FNT%2FYX%2FLV5OQ3V4D8WZ1F.jpg?h=800,https://cdn.dealrimages.com/F2%2FC0%2FA2%2FHZY9BCR4O0ZG8C.jpg?h=800,https://cdn.dealrimages.com/2V%2FDJ%2FJT%2F2V082COPUZ2ZHG.jpg?h=800,https://cdn.dealrimages.com/61%2FW4%2F4S%2F7S9SKMZVV5EPLH.jpg?h=800,https://cdn.dealrimages.com/K9%2FWY%2FRR%2F5W6TU2B38Z30NS.jpg?h=800,https://cdn.dealrimages.com/FZ%2F7Y%2FQJ%2F9V842KDNJ0V962.jpg?h=800,https://cdn.dealrimages.com/A3%2FTU%2FOZ%2FVDHAG0IMGQK4D9.jpg?h=800,https://cdn.dealrimages.com/8G%2FXA%2FXO%2FA93XEENY6J7RMN.jpg?h=800,https://cdn.dealrimages.com/8Q%2FIZ%2FV4%2FP9JKYO0E1CHSCK.jpg?h=800,https://cdn.dealrimages.com/RS%2FGC%2F1N%2FQP9ULAZH8PIEGN.jpg?h=800,https://cdn.dealrimages.com/PV%2F3F%2F4O%2FJX5OI111X9OMHE.jpg?h=800,https://cdn.dealrimages.com/CK%2F2W%2FP0%2F8IKKPO0W67YSF8.jpg?h=800,https://cdn.dealrimages.com/9Q%2FWP%2FVM%2FSPISF15IGU55IQ.jpg?h=800,https://cdn.dealrimages.com/20%2FTK%2FI4%2FABREVX1BVQYPLM.jpg?h=800,https://cdn.dealrimages.com/71%2FVM%2FJM%2F9AP853ZXWEN74K.jpg?h=800,https://cdn.dealrimages.com/FD%2F6R%2FF7%2FAIXZ1S9PIYBUY7.jpg?h=800,https://cdn.dealrimages.com/SN%2FG7%2FTO%2FTWVEFQBSKW8FB5.jpg?h=800,https://cdn.dealrimages.com/CH%2FE5%2FIR%2F32OIS5QF4QQBZM.jpg?h=800,https://cdn.dealrimages.com/6Y%2FRA%2FOQ%2FWXG9EZH4Q7Y356.jpg?h=800,https://cdn.dealrimages.com/ON%2FO5%2FXB%2FZ5XKINQARX8AWI.jpg?h=800,https://cdn.dealrimages.com/49%2F6S%2FUF%2FA9JQUFLJ2U2IEP.jpg?h=800,https://cdn.dealrimages.com/WK%2FTL%2FN3%2FRCAJPI4FODJK0T.jpg?h=800,https://cdn.dealrimages.com/ZV%2FJX%2FHX%2FVW4XOH2BRD3H1W.jpg?h=800,https://cdn.dealrimages.com/BQ%2FTM%2FN5%2FOYRMDBPPO2HP9W.jpg?h=800,https://cdn.dealrimages.com/TW%2FBJ%2FV2%2F4YRHBDVMMIZ7CV.jpg?h=800,https://cdn.dealrimages.com/LK%2FKG%2FP5%2FS29FHJG7Q71LJ7.jpg?h=800","1970-01-01T00:00:00+00:00","","2024-11-26","","","21","","https://www.premiummotors.com//viewInventory/834002/","","","834002","14778 E Broad St.","Reynoldsburg","OH","43068","(614) 412-3429","sales@premiummotors.com"
"451730","Premium Motors LLC","0","3C4PDCABXKT859185","11796","2019","Dodge","Journey","SE Value Package","SUV","","0","0","","11990","","","","","60028","","gas","Gray","","Black","","Cloth","","4","2.4","4","fwd","4-Speed Shiftable Automatic","","Backup Camera,Roof rails: black,Driver seat manual adjustments: height  reclining, 6,Front headrests: adjustable  2,Front seat type: bucket,Passenger seat manual adjustments: reclining  4,Rear headrests: adjustable  3,Rear seat folding: flat  split,Rear seat manual adjustments: reclining,Rear seat type: 60-40 split bench,Third row headrests: adjustable  2,Third row seat folding: flat  split,Third row seat type: 50-50 split bench,Upholstery: premium cloth,ABS: 4-wheel,Braking assist: ,Electronic brakeforce distribution: ,Front brake diameter: 13.0,Front brake type: ventilated disc,Front brake width: 1.1,Power brakes: ,Rear brake diameter: 12.9,Rear brake type: disc,Rear brake width: 0.47,Alternator: 160 amps,Battery: maintenance-free,Battery rating: 525 CCA,Battery saver: ,Emissions: 50 state,Daytime running lights: ,Headlights: auto delay off  auto on/off, halogen, quad headlights,Active head restraints: dual front,Camera system: rearview,Child safety door locks: ,Child seat anchors: LATCH system,Crumple zones: front  rear,Rearview monitor: in dash,Airbag deactivation: occupant sensing passenger,Front airbags: dual,Knee airbags: driver,Side airbags: front,Side curtain airbags: front  rear, third row,Side mirror adjustments: manual folding  power,Side mirrors: heated,Front wipers: variable intermittent,Liftgate window: fixed,Power windows: safety reverse,Rear wiper: intermittent  with washer,Solar-tinted glass: ,Window defogger: rear,Anti-theft system: vehicle immobilizer,Power door locks: auto-locking,Steering ratio: 16.5,Turns lock-to-lock: 2.90,Emergency locking retractors: front  rear,Front seatbelts: 3-point,Rear seatbelts: 3-point,Seatbelt force limiters: front,Seatbelt pretensioners: front,Seatbelt warning sensor: front,Third row seatbelts: 3-point,Axle ratio: 4.28,Front shock type: gas,Front spring type: coil,Front stabilizer bar: ,Front struts: MacPherson,Front suspension classification: independent,Front suspension type: lower control arms,Rear shock type: gas,Rear spring type: coil,Rear stabilizer bar: ,Rear suspension classification: independent,Rear suspension type: multi-link,Antenna type: mast,Auxiliary audio input: USB  jack,Radio: AM/FM  touch screen display,Radio data system: ,Speed sensitive volume control: ,Total speakers: 6,Spare tire mount location: underbody,Spare tire size: temporary,Spare wheel type: steel,Tire Pressure Monitoring System: ,Tire type: all season  touring,Wheel covers: full,Wheels: steel,Clock: ,Digital odometer: ,External temperature display: ,Fuel economy display: MPG  range,Gauge: tachometer,Instrument cluster screen size: 3.5 in.,Multi-function display: ,Trip odometer: ,Warnings and reminders: low fuel level  maintenance due,Air filtration: ,Front air conditioning: automatic climate control,Front air conditioning zones: dual,Armrests: rear center folding with storage and pass-thru,Door sill trim: scuff plate,Floor mat material: carpet,Floor material: cargo area carpet  carpet,Floor mats: front  rear,Interior accents: metallic-tone,Shift knob trim: urethane,Steering wheel trim: urethane,Door handle color: body-color,Front bumper color: body-color,Grille color: chrome,Mirror color: black,Rear bumper color: body-color,Rear spoiler: roofline,Rear spoiler color: body-color,Rear trunk/liftgate: liftgate,Window trim: black,Assist handle: front  rear,Cargo area light: ,Center console: front console with armrest and storage,Cruise control: ,Cupholders: front  illuminated, rear,Easy entry: manual rear seat,Multi-function remote: panic alarm  proximity entry system, trunk release,One-touch windows: 1,Power outlet(s): 12V cargo area  12V front, 12V rear,Power steering: ,Power windows: lockout button,Push-button start: ,Reading lights: front  rear,Rearview mirror: auto-dimming,Steering wheel: tilt and telescopic,Steering wheel mounted controls: audio  cruise control,Storage: cargo tie-down anchors and hooks  door pockets, front seatback, in floor,Vanity mirrors: dual,Infotainment: Uconnect,Infotainment screen size: 4.3 in.,Roll stability control: ,Stability control: ,Traction control: ,Trailer stability control: ","","https://cdn.dealrimages.com/9A%2FFU%2FB6%2FQZKL429EXEKP2Y.jpg?h=800,https://cdn.dealrimages.com/PS%2FU9%2FL6%2FFINYG6TZTG0O9P.jpg?h=800,https://cdn.dealrimages.com/DR%2FT7%2F4N%2FLZPCE5KDOH2BJA.jpg?h=800,https://cdn.dealrimages.com/G2%2F3D%2FRW%2FF814QCADW3BRFY.jpg?h=800,https://cdn.dealrimages.com/G1%2F19%2FFD%2FGRYL4FM1JC49PF.jpg?h=800,https://cdn.dealrimages.com/U8%2FV5%2FRI%2FYU0DFN14Z1LYUL.jpg?h=800,https://cdn.dealrimages.com/1N%2FMZ%2F4G%2FAQZHHIMKWEYZ1X.jpg?h=800,https://cdn.dealrimages.com/8V%2FAV%2FP6%2FI8ZLI0K2M8EAWL.jpg?h=800,https://cdn.dealrimages.com/BB%2FKE%2FJY%2FFCE83EJP2ZYSM0.jpg?h=800,https://cdn.dealrimages.com/YS%2FNJ%2FQX%2F96S4QI68XCO8GT.jpg?h=800,https://cdn.dealrimages.com/ON%2FIO%2FAB%2F3D7EPP2APO9HGY.jpg?h=800,https://cdn.dealrimages.com/MB%2FIH%2F78%2FF7W5SGOHEHDGGH.jpg?h=800,https://cdn.dealrimages.com/6S%2FAZ%2FRZ%2FJVUB2VFETV75WV.jpg?h=800,https://cdn.dealrimages.com/Y5%2FHT%2FBY%2FNCZUEIQTPT991U.jpg?h=800,https://cdn.dealrimages.com/WJ%2F7A%2FZI%2FIGIKBAS5TO7OKO.jpg?h=800,https://cdn.dealrimages.com/GP%2FNM%2F5X%2FDOWI340BIVU3O6.jpg?h=800,https://cdn.dealrimages.com/M5%2F4S%2FFW%2FGX700ZNM1P9GL5.jpg?h=800,https://cdn.dealrimages.com/QV%2FBB%2F1O%2FNJ1SMBROCC4M4T.jpg?h=800,https://cdn.dealrimages.com/0E%2FKO%2F34%2FRKBO0FA12ZY4N7.jpg?h=800,https://cdn.dealrimages.com/Q7%2F15%2FIE%2FHQBYJJPE3D6JMT.jpg?h=800,https://cdn.dealrimages.com/4D%2FZI%2FHZ%2FS04NLZ8ZWKNLPP.jpg?h=800,https://cdn.dealrimages.com/V5%2FRI%2FZ0%2FSHE1KSXGCAXMBE.jpg?h=800,https://cdn.dealrimages.com/T5%2FMM%2FFQ%2FAK9MGFKZLAWABB.jpg?h=800,https://cdn.dealrimages.com/O4%2FUO%2F5M%2F10XA9UWKOZG2JR.jpg?h=800,https://cdn.dealrimages.com/H7%2FA2%2FKG%2FKMGMRMAZM4M58Q.jpg?h=800,https://cdn.dealrimages.com/K5%2FI1%2F4E%2F7DAAOPITGZU6C0.jpg?h=800,https://cdn.dealrimages.com/CC%2FPZ%2FGK%2F466IFXP9PNEN8Q.jpg?h=800,https://cdn.dealrimages.com/3V%2FNK%2FVZ%2FBXVGN1PKTONMIU.jpg?h=800,https://cdn.dealrimages.com/3H%2FWQ%2F4C%2FTU403BSDRT8Q0E.jpg?h=800,https://cdn.dealrimages.com/AC%2FXQ%2FSU%2FP5IUVL598AUEJZ.jpg?h=800,https://cdn.dealrimages.com/FB%2FF2%2FAR%2FCS1QVX3VPOK6AZ.jpg?h=800","1970-01-01T00:00:00+00:00","","2024-10-08","","","19","","https://www.premiummotors.com//viewInventory/814516/","","","814516","14778 E Broad St.","Reynoldsburg","OH","43068","(614) 412-3429","sales@premiummotors.com"
"451730","Premium Motors LLC","0","JM3KE4CY0G0888236","11808","2016","Mazda","CX-5","Touring","SUV","","0","0","","12490","","","","","83547","","gas","Gray","","Black","","Cloth","","4","2.5","4","awd","6-Speed Shiftable Automatic","","Sunroof/Moonroof,Heated Seats,Bluetooth,Backup Camera,Driver seat manual adjustments: lumbar,Driver seat power adjustments: height  reclining, 6,Front headrests: adjustable  2,Front seat type: bucket,Passenger seat manual adjustments:   height,Rear headrests: adjustable  3,Rear seat folding: one-touch fold flat  split,Rear seat type: 40-20-40 split bench,Upholstery: premium cloth,ABS: 4-wheel,Braking assist: ,Electronic brakeforce distribution: ,Electronic parking brake: ,Front brake diameter: 11.7,Front brake type: ventilated disc,Front brake width: 1.1,Power brakes: ,Rear brake diameter: 11.9,Rear brake type: disc,Rear brake width: 0.4,Alternator: 100 amps,Daytime running lights: LED,Exterior entry lights: approach lamps,Front fog lights: ,Headlights: auto off  halogen,Blind spot safety: sensor/alert,Camera system: rearview,Child safety door locks: ,Child seat anchors: LATCH system,Cross traffic alert: rear,Crumple zones: front  rear,Impact absorbing seats: dual front,Impact sensor: door unlock  post-collision safety system,Rearview monitor: in dash,Safety brake pedal system: ,Airbag deactivation: occupant sensing passenger,Front airbags: dual,Side airbags: front,Side curtain airbags: front  rear,Side mirror adjustments: manual folding  power,Side mirrors: integrated turn signals,Front wipers: variable intermittent,Liftgate window: fixed,Power windows: ,Rear privacy glass: ,Rear wiper: intermittent,Window defogger: rear,Anti-theft system: alarm  vehicle immobilizer,Power door locks: anti-lockout  auto-locking,Steering ratio: 15.5,Turns lock-to-lock: 2.7,Emergency locking retractors: front  rear,Front seatbelts: 3-point,Rear seatbelts: 3-point,Seatbelt force limiters: front,Seatbelt pretensioners: front,Seatbelt warning sensor: front,4WD type: on demand,Axle ratio: 4.62,Front shock type: twin-tube gas,Front spring type: coil,Front stabilizer bar: ,Front struts: MacPherson,Front suspension classification: independent,Front suspension type: lower control arms,Rear shock type: twin-tube gas,Rear spring type: coil,Rear stabilizer bar: ,Rear suspension classification: independent,Rear suspension type: multi-link,Electronic messaging assistance: with read function,Hands-free phone call integration: voice operated,Wireless data link: Bluetooth,Antenna type: mast,Auxiliary audio input: Bluetooth  USB, iPod/iPhone, jack,In-Dash CD: MP3 Playback  single disc,Internet radio app: AHA  Pandora, Stitcher,Radio: AM/FM  HD radio, touch screen display, voice operated,Radio data system: ,Speed sensitive volume control: ,Total speakers: 6,Spare tire mount location: inside,Spare tire size: temporary,Spare wheel type: steel,Tire Pressure Monitoring System: ,Tire type: all season,Wheels: aluminum alloy,Clock: ,Digital odometer: ,External temperature display: ,Fuel economy display: MPG  range,Gauge: tachometer,Multi-function display: ,Trip odometer: ,Warnings and reminders: coolant temperature warning  lamp failure, low fuel level, low oil pressure,Air filtration: ,Front air conditioning: ,Front air conditioning zones: single,Rear vents: second row,Armrests: rear center with cupholders,Door trim: cloth,Floor mat material: carpet,Floor material: carpet,Floor mats: front  rear,Shift knob trim: leather,Steering wheel trim: leather,Door handle color: body-color,Exhaust: dual tip,Exhaust tip color: metallic,Front bumper color: body-color,Mirror color: body-color,Rear bumper color: body-color,Rear spoiler: roofline,Rear spoiler color: body-color,Rear trunk/liftgate: liftgate,Window trim: black,Assist handle: front  rear,Cargo area light: ,Center console: front console with armrest and storage,Cruise control: ,Cupholders: front  rear,Multi-function remote: panic alarm  proximity entry system, trunk release,One-touch windows: 1,Overhead console: front,Power outlet(s): cargo area  front,Power steering:   variable/speed-proportional,Power windows: lockout button,Push-button start: ,Reading lights: front  rear,Rearview mirror: manual day/night,Steering wheel: tilt and telescopic,Steering wheel mounted controls: audio  cruise control, phone,Storage: accessory hook  cargo tie-down anchors and hooks, door pockets, front seatback, in dash, sunglasses holder,Touch-sensitive controls: ,Vanity mirrors: dual illuminating,Infotainment: MAZDA CONNECT,Infotainment screen size: 7 in.,Hill holder control: ,Stability control: ,Traction control: ","","https://cdn.dealrimages.com/J5%2F62%2FYJ%2FM4Z9E0PWRACKGJ.jpg?h=800,https://cdn.dealrimages.com/IC%2FRR%2FKH%2F3T2UIQ45O42NDT.jpg?h=800,https://cdn.dealrimages.com/WV%2F2Y%2F5R%2F94QMDBMJ7MZS0X.jpg?h=800,https://cdn.dealrimages.com/28%2FRD%2FV1%2FOPNUN7MTCSAN87.jpg?h=800,https://cdn.dealrimages.com/N8%2FIH%2FLV%2FKFX8Y3W8CGELAK.jpg?h=800,https://cdn.dealrimages.com/U9%2FM8%2F2G%2FYIRN1SLS9VUOEN.jpg?h=800,https://cdn.dealrimages.com/R4%2FN5%2FH3%2F5XC4QJM30JL95M.jpg?h=800,https://cdn.dealrimages.com/Y0%2FUR%2FGT%2FW5F2TJZM2DDIRO.jpg?h=800,https://cdn.dealrimages.com/K4%2F62%2F0M%2FWRXKQ9CCIC37SV.jpg?h=800,https://cdn.dealrimages.com/I4%2FWR%2FSK%2F73WD0WNK6I6L2W.jpg?h=800,https://cdn.dealrimages.com/3M%2FQS%2F6M%2FLQPCNZMX0F0SS5.jpg?h=800,https://cdn.dealrimages.com/WP%2FKP%2FUO%2FBW7FRMNY79OJEG.jpg?h=800,https://cdn.dealrimages.com/QV%2F7R%2FN2%2FHS9Q4W9HYB03MG.jpg?h=800,https://cdn.dealrimages.com/A7%2FXL%2FAJ%2FCVYCY41GSYZBRK.jpg?h=800,https://cdn.dealrimages.com/UJ%2FGB%2FGS%2FN877G1F83P9GDS.jpg?h=800,https://cdn.dealrimages.com/2B%2FDG%2FKH%2FO7YIEZCWWZWTI9.jpg?h=800,https://cdn.dealrimages.com/H3%2F5W%2FUM%2FJMCC8REXNOMOPA.jpg?h=800,https://cdn.dealrimages.com/LV%2FWL%2FX3%2F2Y9T8MQP5WYMVH.jpg?h=800,https://cdn.dealrimages.com/VO%2FT1%2FJH%2FI7P7789F6W2AJ6.jpg?h=800,https://cdn.dealrimages.com/YE%2FT1%2FT2%2FOCU5OWZDT9SEJR.jpg?h=800,https://cdn.dealrimages.com/3C%2F2Q%2FZC%2FZ9OWL613U5BS4F.jpg?h=800,https://cdn.dealrimages.com/YY%2FFC%2F6J%2F9XIRXIWCVGDRKV.jpg?h=800,https://cdn.dealrimages.com/6D%2FPQ%2FOL%2F4R88FS8YTPL5IH.jpg?h=800,https://cdn.dealrimages.com/DG%2FL0%2FMW%2FB3O5GHOUDGTN2L.jpg?h=800,https://cdn.dealrimages.com/84%2F6A%2FZC%2FBLYP5MD31OLV3U.jpg?h=800,https://cdn.dealrimages.com/6Z%2FA7%2FO0%2FFZWB9YZJ0CJBCY.jpg?h=800,https://cdn.dealrimages.com/L9%2FJD%2FUG%2FAGJQLSG4AO16QJ.jpg?h=800,https://cdn.dealrimages.com/HO%2FKB%2FHR%2FQSRQ2QFLC01JVV.jpg?h=800,https://cdn.dealrimages.com/RG%2FMX%2FJO%2FRE3BBKHI7EP8YC.jpg?h=800,https://cdn.dealrimages.com/1L%2FKJ%2FJ0%2F9JXFD2N2WI2V6Y.jpg?h=800,https://cdn.dealrimages.com/31%2FQQ%2FW2%2FUNTDQC0J34FYHT.jpg?h=800,https://cdn.dealrimages.com/Q9%2FW2%2FAC%2FDKCC15KR0RVWRH.jpg?h=800,https://cdn.dealrimages.com/7S%2F0N%2FNP%2F4T47U29HR1FSLX.jpg?h=800,https://cdn.dealrimages.com/BY%2FRB%2F66%2FLOIEHXK1MM48BN.jpg?h=800,https://cdn.dealrimages.com/QX%2F59%2FCT%2FRNJWP65QRA5PF5.jpg?h=800","1970-01-01T00:00:00+00:00","","2024-10-29","","","24","","https://www.premiummotors.com//viewInventory/822809/","","","822809","14778 E Broad St.","Reynoldsburg","OH","43068","(614) 412-3429","sales@premiummotors.com"
