"DealerID","DealerName","IsNew","VIN","Stock","Year","Make","Model","Trim","BodyStyle","BodyType","FactoryCertified","DealerCertified","ModelCode","ListPrice","SpecialPrice","CostPrice","ExtraPrice1","ExtraPrice2","Mileage","ChromeStyleID","FuelType","Exteriorcolor","Exteriorcolorcode","Interiorcolor","Interiorcolorcode","Interiormaterial","Wheelbase","DoorCount","EngineDisplacement","Cylinders","Drivetrain","Transmission","TransmissionSpeed","OptionDescription","OptionCodes","PhotoURL","PhotoTimestamp","DealerComments","InstockDate","LastModifiedDate","VideoURL","CityMPG","HwyMPG","ExtraField1","ExtraField2","ExtraField3","VehicleID","Address1","City","State","Zip","Dealer Phone","Dealer Email"
"451730","Premium Motors LLC","0","5XYPGDA59GG171930","11850","2016","Kia","Sorento","LX V6","SUV","","0","0","","0","","","","","137952","","gas","White","","Beige","","Cloth","","4","3.3","6","awd","6-Speed Shiftable Automatic","","Bluetooth,Backup Camera,Roof rails: silver,Driver seat manual adjustments:   height, reclining,Front headrests: adjustable  2,Front seat type: bucket,Passenger seat manual adjustments:   reclining,Rear headrests: adjustable  3,Rear seat: sliding,Rear seat folding: one-touch fold flat  split,Rear seat type: 40-20-40 split bench,Third row headrests: 2,Third row seat folding: flat  split,Third row seat type: 50-50 split bench,Upholstery: cloth,ABS: 4-wheel,Braking assist: ,Electronic brakeforce distribution: ,Front brake diameter: 12.6,Front brake type: ventilated disc,Power brakes: ,Rear brake diameter: 12.1,Rear brake type: disc,Battery saver: ,Headlights: LED  auto on/off,Active head restraints: dual front,Camera system: rearview,Child safety door locks: ,Child seat anchors: LATCH system,Crumple zones: front  rear,Impact sensor: door unlock,Rearview monitor: in dash,Airbag deactivation: occupant sensing passenger,Front airbags: dual,Side airbags: front,Side curtain airbags: front  rear,Side mirror adjustments: manual folding  power,Side mirrors: heated  integrated turn signals,Front wipers: variable intermittent,Laminated glass: ,Liftgate window: fixed,Power windows: ,Rear privacy glass: ,Rear wiper: intermittent  with washer,Solar-tinted glass: ,Window defogger: rear,Anti-theft system: alarm,Power door locks: auto-locking,Steering ratio: 14.3,Front seatbelts: 3-point,Rear seatbelts: 3-point,Seatbelt pretensioners: front,Seatbelt warning sensor: front,Third row seatbelts: 3-point,4WD type: on demand,Axle ratio: 3.32,Drive mode selector: ,Locking differential: center,Front shock type: gas,Front spring type: coil,Front stabilizer bar: ,Front struts: MacPherson,Front suspension classification: independent,Front suspension type: lower control arms,Rear shock type: gas,Rear spring type: coil,Rear stabilizer bar: ,Rear suspension classification: independent,Rear suspension type: multi-link,Wireless data link: Bluetooth,Antenna type: diversity  mast,Auxiliary audio input: Bluetooth  USB, iPod/iPhone, jack,In-Dash CD: MP3 Playback  single disc,Radio: AM/FM,Radio data system: ,Satellite radio: SiriusXM,Speed sensitive volume control: ,Total speakers: 6,Spare tire mount location: underbody,Spare tire size: temporary,Spare wheel type: steel,Tire Pressure Monitoring System: ,Tire type: all season,Wheels: alloy,Clock: ,Digital odometer: ,External temperature display: ,Fuel economy display: MPG  range,Gauge: tachometer,Multi-function display: ,Trip odometer: ,Warnings and reminders: low fuel level  low oil level, low washer fluid,Air filtration: ,Front air conditioning: ,Front air conditioning zones: single,Rear vents: second row,Armrests: rear center with cupholders  rear folding,Interior accents: wood-tone,Shift knob trim: urethane,Steering wheel trim: urethane,Door handle color: metallic,Exhaust tip color: stainless steel,Front bumper color: body-color,Grille color: black,Mirror color: body-color,Rear bumper color: body-color,Rear spoiler: roofline,Rear spoiler color: body-color,Rear trunk/liftgate: liftgate,Window trim: silver,Ambient lighting: ,Assist handle: passenger side  rear,Cargo area light: ,Center console: front console with armrest and storage,Cruise control: ,Cupholders: front  rear,Easy entry: manual rear seat,Multi-function remote: fuel filler door release  keyless entry, panic alarm, trunk release,One-touch windows: 1,Overhead console: front,Power outlet(s): 12V cargo area  two 12V,Power steering: ,Power windows: lockout button,Reading lights: front  rear,Rearview mirror: manual day/night,Steering wheel: tilt and telescopic,Steering wheel mounted controls: audio  cruise control, phone,Storage: door pockets  front seatback, sunglasses holder,Vanity mirrors: dual illuminating,Hill holder control: ,Off-road driving assist: hill descent,Stability control: ,Traction control: ","","https://cdn.dealrimages.com/XU%2FBD%2F2R%2FWY6CHL939HGFGE.jpg?h=800,https://cdn.dealrimages.com/XP%2FN7%2F0M%2F7G9FPZZH70CGVO.jpg?h=800,https://cdn.dealrimages.com/2W%2F91%2FDO%2FKPS4ZQXZ1LZ0F9.jpg?h=800,https://cdn.dealrimages.com/PM%2F4B%2FOP%2FNQAXMOWWD7FDKM.jpg?h=800,https://cdn.dealrimages.com/QQ%2F59%2FKN%2FG08K3BT2CQI28R.jpg?h=800,https://cdn.dealrimages.com/RS%2FV5%2FRT%2F3BOGD6FTXEDZQF.jpg?h=800,https://cdn.dealrimages.com/SS%2F1O%2F6N%2F870A3LBH2ST2TY.jpg?h=800,https://cdn.dealrimages.com/UN%2FFJ%2F7C%2FEJU2RIQ7ZZWONF.jpg?h=800,https://cdn.dealrimages.com/L9%2FTK%2FB3%2FSEO8T9MMTNKGUG.jpg?h=800,https://cdn.dealrimages.com/F6%2FCZ%2FPB%2FGWPM7XX7ICLO2B.jpg?h=800,https://cdn.dealrimages.com/EB%2FAA%2FDH%2FCIU84O01JRP2YJ.jpg?h=800,https://cdn.dealrimages.com/X4%2FI3%2FTF%2F57MJ5RQQ4BQMQB.jpg?h=800,https://cdn.dealrimages.com/7R%2F9Z%2FL5%2F3WO5LQDS54JZUW.jpg?h=800,https://cdn.dealrimages.com/P8%2FQ1%2F8W%2F4S6BWPAO2ZV2NM.jpg?h=800,https://cdn.dealrimages.com/LK%2FRA%2FIP%2FP31WTZGK6S9BCC.jpg?h=800,https://cdn.dealrimages.com/K2%2F2T%2FHU%2FZZDYEZGYH9GG6C.jpg?h=800,https://cdn.dealrimages.com/9B%2FKC%2F7Q%2FZPU2VVX5FR7MOM.jpg?h=800,https://cdn.dealrimages.com/HT%2FKA%2FL3%2FY5FWUMCVIWL0WC.jpg?h=800,https://cdn.dealrimages.com/I6%2FL7%2F6A%2F8D4IAQPJP4B4A5.jpg?h=800,https://cdn.dealrimages.com/KO%2F9G%2FEA%2F6Z1OJ8NYFTSGGG.jpg?h=800,https://cdn.dealrimages.com/PP%2F64%2FVA%2FA9P1GE0NRYHZPS.jpg?h=800,https://cdn.dealrimages.com/TK%2FBW%2FLX%2FJIBBKJMK6Q3QE6.jpg?h=800,https://cdn.dealrimages.com/S3%2FU3%2F6Z%2FHCJP8BTWB7OA57.jpg?h=800,https://cdn.dealrimages.com/JC%2FPV%2FAM%2FYPMKIZOJU5UDYR.jpg?h=800,https://cdn.dealrimages.com/IU%2F67%2FQI%2FVX59TN3H65JIG0.jpg?h=800,https://cdn.dealrimages.com/LK%2FOJ%2FBZ%2F6NGV52Y2QAAO8Z.jpg?h=800,https://cdn.dealrimages.com/27%2FQB%2FJN%2F17DNK77THQR2DS.jpg?h=800,https://cdn.dealrimages.com/PX%2F66%2FY4%2F69REK5HYW89APD.jpg?h=800,https://cdn.dealrimages.com/VQ%2F8M%2F1E%2FEF0SSVBDYG8R9O.jpg?h=800,https://cdn.dealrimages.com/AM%2FI0%2FBL%2F570UXWJ2JEEQN0.jpg?h=800,https://cdn.dealrimages.com/M1%2FBN%2FAT%2F1NB35FYJZZBAXA.jpg?h=800,https://cdn.dealrimages.com/NF%2FMP%2F9N%2FRMUCUBE8DE1S0R.jpg?h=800","1970-01-01T00:00:00+00:00","","2025-01-02","","","17","","https://www.premiummotors.com//viewInventory/847901/","","","847901","14778 E Broad St.","Reynoldsburg","OH","43068","(614) 412-3429","sales@premiummotors.com"
"451730","Premium Motors LLC","0","3HGGK5H68JM709273","11851","2018","Honda","Fit","Sport","Car","","0","0","","9990","","","","","122092","","gas","White","","Black","","Cloth","","4","1.5","4","fwd","7-Speed Shiftable CVT","","Bluetooth,Backup Camera,Liftgate window: fixed,Rear door type: liftgate,Driver seat manual adjustments: height  reclining, 6,Front headrests: adjustable  2,Front seat type: bucket,Passenger seat manual adjustments: reclining  4,Rear headrests: adjustable  3,Rear seat folding: flat  split,Rear seat type: 60-40 split bench,Upholstery: cloth,Upholstery accents: contrast stitching,ABS: 4-wheel,Braking assist: ,Electronic brakeforce distribution: ,Front brake diameter: 10.3,Front brake type: ventilated disc,Power brakes: ,Rear brake diameter: 7.9,Rear brake type: drum,Daytime running lights: ,Front fog lights: ,Headlights: auto on/off  halogen,Taillights: LED,Body side reinforcements: side impact door beams,Camera system: rear multi-view,Child safety door locks: ,Child seat anchors: LATCH system,Crumple zones: front,Energy absorbing steering column: ,Impact absorbing bumpers: ,Rearview monitor: in dash,Airbag deactivation: occupant sensing passenger,Front airbags: dual,Side airbags: front,Side curtain airbags: front  rear,Side-curtain airbag rollover sensor: ,Side mirror adjustments: manual folding  power,Front wipers: intermittent,Power windows: safety reverse,Rear wiper: intermittent  with washer,Window defogger: rear,2-stage unlocking doors: ,Anti-theft system: alarm  engine immobilizer,Power door locks: auto-locking,Steering ratio: 13.1,Turns lock-to-lock: 2.5,Emergency locking retractors: front  rear,Front seatbelts: 3-point,Rear seatbelts: 3-point,Seatbelt force limiters: front,Seatbelt pretensioners: front,Seatbelt warning sensor: front,Axle ratio: 5.44,Drive mode selector: ,Front shock type: gas,Front spring type: coil,Front stabilizer bar: diameter 25 mm,Front struts: MacPherson,Front suspension classification: independent,Front suspension type: lower control arms,Rear shock type: gas,Rear spring type: coil,Rear suspension classification: semi-independent,Rear suspension type: torsion beam,Electronic messaging assistance: with read function,Wireless data link: Bluetooth,Antenna type: mast,Auxiliary audio input: Bluetooth  USB, iPod/iPhone,Internet radio app: Pandora,Radio: AM/FM  touch screen display,Radio data system: ,Speed sensitive volume control: ,Total speakers: 6,Watts: 180,Spare tire mount location: inside,Spare tire size: temporary,Spare wheel type: steel,Tire Pressure Monitoring System: ,Tire type: all season,Wheels: painted alloy,Clock: ,Digital odometer: ,External temperature display: ,Fuel economy display: MPG  range,Gauge: tachometer,Instrument cluster screen size: 4.2 in.,Multi-function display: ,Trip odometer: ,Warnings and reminders: low battery  low fuel level, maintenance due, tire fill alert,Air filtration: ,Front air conditioning: ,Front air conditioning zones: single,Dash trim: simulated alloy,Door trim: simulated alloy,Floor material: carpet,Shift knob trim: leather,Steering wheel trim: leather,Door handle color: body-color,Exhaust tip color: chrome,Front bumper color: body-color,Grille color: black with chrome accents,Ground effects/lower spoilers: ,Mirror color: body-color,Rear bumper color: body-color,Rear spoiler: roofline,Rear spoiler color: body-color,Window trim: black,Assist handle: front  rear,Cargo area light: ,Center console: front console with armrest and storage,Cruise control: ,Cupholders: front,Multi-function remote: fuel filler door release  keyless entry, trunk release,One-touch windows: 1,Power outlet(s): 12V front,Power steering: ,Power windows: lockout button,Reading lights: front,Rearview mirror: manual day/night,Retained accessory power: ,Steering wheel: tilt and telescopic,Steering wheel mounted controls: audio  cruise control, multi-function, paddle shifter, phone,Storage: door pockets  front seatback,Vanity mirrors: dual,Connected in-car apps: Google POIs  Google search,Infotainment: HondaLink,Infotainment screen size: 7 in.,Smartphone integration: Android Auto  Apple CarPlay,Hill holder control: ,Stability control: ,Traction control: ","","https://cdn.dealrimages.com/H3%2FLL%2FY3%2FDRDRVFNFSBOXFM.jpg?h=800,https://cdn.dealrimages.com/TO%2F43%2FW6%2F6G4F1K65BBPYZ2.jpg?h=800,https://cdn.dealrimages.com/HT%2FS9%2FER%2F71Y7NZHTJ82O2M.jpg?h=800,https://cdn.dealrimages.com/7E%2FF9%2FIW%2FA2HHYX1RBH9BCJ.jpg?h=800,https://cdn.dealrimages.com/RP%2F85%2FU0%2FO2UGWMMYE9ROF8.jpg?h=800,https://cdn.dealrimages.com/N8%2F3Q%2FV0%2F8NZ9Y4XXXNPBGI.jpg?h=800,https://cdn.dealrimages.com/KM%2F65%2FPG%2FKZR1418KSB3Q17.jpg?h=800,https://cdn.dealrimages.com/3F%2FI6%2FTH%2FIV75AOY3ONAXM0.jpg?h=800,https://cdn.dealrimages.com/QK%2F0Z%2FW6%2FE39BTGMIZY2QPL.jpg?h=800,https://cdn.dealrimages.com/Y3%2FMT%2FYM%2FGQUR3YHESIL81T.jpg?h=800,https://cdn.dealrimages.com/83%2FO4%2F8E%2FV24LVN3LN70HGU.jpg?h=800,https://cdn.dealrimages.com/4U%2F0J%2FH8%2FZ4WGFMIUMHXL0L.jpg?h=800,https://cdn.dealrimages.com/4K%2FQ0%2F7M%2F7GO8IG8JB616H6.jpg?h=800,https://cdn.dealrimages.com/EE%2F5E%2F05%2FZM3FZOHJ7SMNDB.jpg?h=800,https://cdn.dealrimages.com/FX%2FND%2F1P%2FW19M7P5682A303.jpg?h=800,https://cdn.dealrimages.com/YT%2FC3%2FUK%2FNHXN0FL2GG15JB.jpg?h=800,https://cdn.dealrimages.com/Z4%2F0E%2FRY%2FBT285C433G2ESD.jpg?h=800,https://cdn.dealrimages.com/OR%2FDZ%2F9A%2FFQ2PLZ7ATNSJ43.jpg?h=800,https://cdn.dealrimages.com/L7%2FCU%2F34%2FRC9TOH13A3T2IM.jpg?h=800,https://cdn.dealrimages.com/KB%2FA4%2FFB%2FFI3DJPSZI92WQA.jpg?h=800,https://cdn.dealrimages.com/1D%2F57%2FPS%2F6YI6NT3H6ZV83V.jpg?h=800,https://cdn.dealrimages.com/RS%2F8F%2FJ3%2F9LXTT38NVSQ0X8.jpg?h=800,https://cdn.dealrimages.com/K8%2FC7%2FU4%2F5EYNX7XO89MU7H.jpg?h=800,https://cdn.dealrimages.com/QK%2F7G%2F72%2FBN0039ETXWZ6UB.jpg?h=800,https://cdn.dealrimages.com/RV%2FHY%2F7D%2FVC401WJG9C8L1V.jpg?h=800,https://cdn.dealrimages.com/31%2F1R%2F9P%2FR7C9U05ZA1GKV9.jpg?h=800,https://cdn.dealrimages.com/M9%2FS7%2F8L%2FDRLFYMRRJU9K63.jpg?h=800,https://cdn.dealrimages.com/V9%2FQJ%2FHQ%2F4NK9HZC7QUVXUM.jpg?h=800,https://cdn.dealrimages.com/UT%2FCQ%2FAF%2F20FDM6NR9SBNX9.jpg?h=800,https://cdn.dealrimages.com/1Y%2F97%2FKT%2FRZ3UA5YOYOXVVJ.jpg?h=800,https://cdn.dealrimages.com/G6%2F7Q%2FY0%2FCZWKHPL07478WB.jpg?h=800","1970-01-01T00:00:00+00:00","","2025-01-08","","","31","","https://www.premiummotors.com//viewInventory/850595/","","","850595","14778 E Broad St.","Reynoldsburg","OH","43068","(614) 412-3429","sales@premiummotors.com"
"451730","Premium Motors LLC","0","MAJ6S3FL2NC469643","11711","2022","Ford","EcoSport","S","Car","","0","0","","12490","","","","","102523","","gas","White","","Gray","","Cloth","","4","2.0","4","awd","6-Speed Shiftable Automatic","","Bluetooth,Backup Camera,Driver seat manual adjustments: height  lumbar, reclining, 4,Front headrests: adjustable  2,Front seat type: bucket,Passenger seat manual adjustments: reclining  4,Rear headrests: adjustable  foldable, 2,Rear seat folding: flat  flip and fold, split,Rear seat type: 60-40 split bench,Upholstery: cloth,ABS: 4-wheel,Braking assist: ,Cornering brake control: ,Electronic brakeforce distribution: ,Front brake type: ventilated disc,Power brakes: ,Rear brake type: disc,Auto start/stop: ,Battery: maintenance-free,Battery saver: ,Daytime running lights: ,Headlights: auto delay off  auto on/off, halogen, wiper activated,Camera system: rearview,Child safety door locks: ,Child seat anchors: LATCH system,Crumple zones: front,Impact sensor: alert system  door unlock, post-collision safety system,Programmable safety key: ,Rearview monitor: in dash,Airbag deactivation: occupant sensing passenger,Front airbags: dual,Knee airbags: dual front,Side airbags: front  rear,Side curtain airbags: front  rear,Side mirror adjustments: manual folding  power,Front wipers: variable intermittent,Liftgate window: fixed,Power windows: safety reverse,Rear wiper: auto-on in reverse  intermittent, with washer,Window defogger: rear,Anti-theft system: vehicle immobilizer,Power door locks: auto-locking,Steering ratio: 16.0,Emergency locking retractors: front  rear,Front seatbelts: 3-point,Rear seatbelts: 3-point,Seatbelt force limiters: front,Seatbelt pretensioners: front,Seatbelt warning sensor: front,4WD type: on demand,Axle ratio: 3.51,Front shock type: gas,Front spring type: coil,Front stabilizer bar: diameter 26 mm,Front struts: MacPherson,Front suspension classification: independent,Front suspension type: lower control arms,Rear shock type: gas,Rear spring type: coil,Rear stabilizer bar: diameter 21 mm,Rear suspension classification: semi-independent,Rear suspension type: torsion beam,Electronic messaging assistance: voice operated  with read function,Hands-free phone call integration: voice operated,Smart device app compatibility: FordPass Connect,Smart device app function: lock operation  maintenance status, vehicle location,Wi-Fi: hotspot,Wireless data link: Bluetooth,Antenna type: mast,Auxiliary audio input: Bluetooth  USB,Radio: AM/FM  voice operated,Speed sensitive volume control: ,Total speakers: 6,Spare tire kit: inflator kit  tire sealant,Tire Pressure Monitoring System: ,Tire type: all season,Wheels: painted aluminum alloy,Clock: ,Compass: ,Digital odometer: ,External temperature display: ,Fuel economy display: MPG  range,Gauge: tachometer,Instrument cluster screen size: 2.3 in.,Multi-function display: ,Trip odometer: ,Warnings and reminders: low fuel level  maintenance due,Air filtration: ,Front air conditioning: ,Front air conditioning zones: single,Rear vents: second row,Armrests: rear center with cupholders  rear folding,Floor mat material: carpet,Floor material: carpet,Floor mats: front,Shift knob trim: urethane,Steering wheel trim: urethane,Active grille shutters: ,Door handle color: black,Front bumper color: body-color,Grille color: black  black surround,Headlight bezel color: chrome,Mirror color: black,Rear bumper color: black,Rear trunk/liftgate: side-hinged,Rocker panel color: black,Window trim: black,Assist handle: passenger side,Capless fuel filler system: ,Cargo area light: ,Center console: front console with armrest and storage,Cruise control: ,Cupholders: front  rear,Multi-function remote: keyless entry  panic alarm, trunk release,One-touch windows: 1,Overhead console: front,Power outlet(s): 12V front  12V rear,Power steering: variable/speed-proportional,Power windows: lockout button,Reading lights: front  rear,Rearview mirror: manual day/night,Steering wheel: tilt and telescopic,Steering wheel mounted controls: audio  cruise control, multi-function, phone, voice control,Storage: accessory hook  cargo tie-down anchors and hooks, door pockets, grocery bag holder, sunglasses holder,Vanity mirrors: dual,Connected in-car apps: app marketplace integration,Infotainment: SYNC,Infotainment screen size: 4.2 in.,Hill holder control: ,Roll stability control: ,Stability control: ,Traction control: ","","https://cdn.dealrimages.com/PV%2FYE%2FCG%2FLWHCFELWZZX043.jpg?h=800,https://cdn.dealrimages.com/UA%2FUD%2FJL%2FJGFIBVMM7M7M7E.jpg?h=800,https://cdn.dealrimages.com/74%2FLL%2F8Z%2FAI1W24K4PDPY13.jpg?h=800,https://cdn.dealrimages.com/PV%2FII%2F03%2FNRF1WJS6V156W5.jpg?h=800,https://cdn.dealrimages.com/7N%2FSZ%2FHC%2F90JTEPSWITCIYL.jpg?h=800,https://cdn.dealrimages.com/B4%2FYZ%2FF4%2FSCX7QNSHSQGMTC.jpg?h=800,https://cdn.dealrimages.com/U4%2F04%2F5I%2F4T5WBUAEBZ2PW8.jpg?h=800,https://cdn.dealrimages.com/39%2FMR%2F67%2FAV6DXNJFYAKOU1.jpg?h=800,https://cdn.dealrimages.com/5F%2FDZ%2FCG%2FN862U25WR3FDEJ.jpg?h=800,https://cdn.dealrimages.com/9F%2FWH%2FTT%2F4Y007GT9100PXR.jpg?h=800,https://cdn.dealrimages.com/WY%2FWA%2FYO%2FCINYYMNDGBCY65.jpg?h=800,https://cdn.dealrimages.com/10%2FWJ%2FIZ%2FV5W1D674ZA26IJ.jpg?h=800,https://cdn.dealrimages.com/OZ%2F3V%2FQV%2FZ42RY52D5B6B8M.jpg?h=800,https://cdn.dealrimages.com/WB%2FFN%2FLA%2FPJFMEUJFQG4G5P.jpg?h=800,https://cdn.dealrimages.com/5P%2FHU%2FFZ%2FCAUEI17CVMPP1B.jpg?h=800,https://cdn.dealrimages.com/FF%2F59%2FVH%2FB060K5BCA276T9.jpg?h=800,https://cdn.dealrimages.com/6T%2FYN%2FB1%2FUNKL36TOT44TJ2.jpg?h=800,https://cdn.dealrimages.com/4W%2FMG%2FXP%2F10ZDMVL23Z59PV.jpg?h=800,https://cdn.dealrimages.com/0M%2F6W%2FJY%2FN9XWGFFRHUWZ05.jpg?h=800,https://cdn.dealrimages.com/WB%2FTJ%2F2W%2F1098OFNXMPF3VZ.jpg?h=800,https://cdn.dealrimages.com/UE%2FKF%2FRI%2FI69S29817WJQEQ.jpg?h=800,https://cdn.dealrimages.com/DG%2F73%2FNQ%2FD3C9IJ1ZN0UPV8.jpg?h=800,https://cdn.dealrimages.com/UM%2FU7%2FRL%2FUV8N2GJQQWLMC5.jpg?h=800,https://cdn.dealrimages.com/CR%2FUU%2F0J%2FSYRH6AOVZZMOI8.jpg?h=800,https://cdn.dealrimages.com/M9%2FFU%2FRX%2F3M5H0ZKTMLTR9A.jpg?h=800,https://cdn.dealrimages.com/T7%2FPP%2F70%2FGWF9OQ5UJPMFY0.jpg?h=800,https://cdn.dealrimages.com/A6%2FXB%2FAO%2FVMHLR6KFVNQYLG.jpg?h=800,https://cdn.dealrimages.com/9B%2FAI%2FFQ%2FDTBV5XY3QRGDB1.jpg?h=800","1970-01-01T00:00:00+00:00","","2024-06-04","","","23","","https://www.premiummotors.com//viewInventory/763439/","","","763439","14778 E Broad St.","Reynoldsburg","OH","43068","(614) 412-3429","sales@premiummotors.com"
