"DealerID","DealerName","IsNew","VIN","Stock","Year","Make","Model","Trim","BodyStyle","BodyType","FactoryCertified","DealerCertified","ModelCode","ListPrice","SpecialPrice","CostPrice","ExtraPrice1","ExtraPrice2","Mileage","ChromeStyleID","FuelType","Exteriorcolor","Exteriorcolorcode","Interiorcolor","Interiorcolorcode","Interiormaterial","Wheelbase","DoorCount","EngineDisplacement","Cylinders","Drivetrain","Transmission","TransmissionSpeed","OptionDescription","OptionCodes","PhotoURL","PhotoTimestamp","DealerComments","InstockDate","LastModifiedDate","VideoURL","CityMPG","HwyMPG","ExtraField1","ExtraField2","ExtraField3","VehicleID","Address1","City","State","Zip","Dealer Phone","Dealer Email"
"451730","Premium Motors LLC","0","JM3KFBCM8J0345030","11827","2018","Mazda","CX-5","Touring","SUV","","0","0","","13490","","","","","104250","","gas","Silver","","Black","","Leather","","4","2.5","4","awd","6-Speed Shiftable Automatic","","Leather Seats,Heated Seats,Bluetooth,Backup Camera,Driver seat: heated,Driver seat manual adjustments: lumbar,Driver seat power adjustments: height  reclining, 6,Front headrests: adjustable  2,Front seat type: bucket,Passenger seat: heated,Passenger seat manual adjustments: height  reclining, 6,Rear headrests: adjustable  3,Rear seat folding: split,Rear seat manual adjustments: reclining,Rear seat type: 40-20-40 split bench,Upholstery: leatherette,Upholstery accents: faux suede,ABS: 4-wheel,Braking assist: ,Cornering brake control: ,Electronic brakeforce distribution: ,Electronic parking brake: auto off,Emergency braking preparation: ,Front brake diameter: 11.7,Front brake type: ventilated disc,Front brake width: 1.1,Power brakes: ,Rear brake diameter: 11.9,Rear brake type: disc,Rear brake width: 0.4,Alternator: 100 amps,Battery: maintenance-free,Battery saver: ,Cylinder deactivation: ,Daytime running lights: ,Exterior entry lights: approach lamps,Headlights: LED  auto delay off, auto high beam dimmer, auto on/off, self-leveling,Automatic emergency braking: front,Blind spot safety: sensor/alert,Camera system: rearview,Child safety door locks: ,Child seat anchors: LATCH system,Cross traffic alert: rear,Crumple zones: front  rear,Impact absorbing seats: dual front,Impact sensor: alert system  door unlock, post-collision safety system,Lane deviation sensors: ,Lane keeping assist: ,Pre-collision warning system: audible warning  visual warning,Rearview monitor: in dash,Safety brake pedal system: ,Airbag deactivation: occupant sensing passenger,Front airbags: dual,Side airbags: front,Side curtain airbags: front  rear,Side mirror adjustments: manual folding  power,Side mirrors: integrated turn signals,Front wipers: rain sensing  speed sensitive, variable intermittent,Liftgate window: fixed,Power windows: safety reverse,Rear privacy glass: ,Rear wiper: intermittent  with washer,Window defogger: rear,Anti-theft system: alarm  vehicle immobilizer,Power door locks: anti-lockout  auto-locking,Steering ratio: 15.5,Turns lock-to-lock: 2.7,Emergency locking retractors: front  rear,Front seatbelts: 3-point,Rear seatbelts: 3-point,Seatbelt force limiters: front,Seatbelt pretensioners: front,Seatbelt warning sensor: front,4WD type: on demand,Axle ratio: 4.62,Drive mode selector: ,Front shock type: twin-tube gas,Front spring type: coil,Front stabilizer bar: ,Front struts: MacPherson,Front suspension classification: independent,Front suspension type: lower control arms,Rear shock type: twin-tube gas,Rear spring type: coil,Rear stabilizer bar: ,Rear suspension classification: independent,Rear suspension type: multi-link,Driver assistance app: roadside assistance,Electronic messaging assistance: voice operated  with read function,Hands-free phone call integration: voice operated,Wireless data link: Bluetooth,Antenna type: mast,Auxiliary audio input: Bluetooth  USB, iPod/iPhone, jack,Internet radio app: AHA  Pandora, Stitcher,Radio: AM/FM  HD radio, touch screen display, voice operated,Radio data system: ,Speed sensitive volume control: ,Total speakers: 6,Spare tire mount location: inside,Spare tire size: temporary,Spare wheel type: steel,Tire Pressure Monitoring System: ,Tire type: all season,Wheels: aluminum alloy,Clock: ,Compass: ,Digital odometer: ,External temperature display: ,Fuel economy display: MPG  range,Gauge: tachometer,Instrument cluster screen size: 4.6 in.,Multi-function display: ,Trip odometer: ,Warnings and reminders: coolant temperature warning  lamp failure, low fuel level, low oil pressure, maintenance due,Air filtration: ,Front air conditioning: automatic climate control,Front air conditioning zones: dual,Rear vents: second row,Armrests: rear center with cupholders  rear folding,Door trim: leatherette,Floor mat material: carpet,Floor material: carpet,Floor mats: front  rear,Shift knob trim: leather,Steering wheel trim: leather,Door handle color: body-color,Exhaust: dual tip,Exhaust tip color: metallic,Fender lip moldings: black,Front bumper color: body-color,Grille color: black  chrome surround,Mirror color: body-color,Rear bumper color: body-color,Rear spoiler: roofline,Rear spoiler color: body-color,Rear trunk/liftgate: liftgate,Rocker panel color: black,Window trim: chrome,Adaptive cruise control: ,Adaptive stop and go cruise control: semi-automatic,Assist handle: front  rear,Cargo area light: ,Center console: front console with armrest and storage,Cupholders: front  rear,Multi-function remote: panic alarm  proximity entry system, trunk release,One-touch windows: 4,Overhead console: front,Power outlet(s): 12V cargo area  12V front,Power steering: variable/speed-proportional,Power windows: lockout button,Push-button start: ,Reading lights: front  rear,Rearview mirror: manual day/night,Steering wheel: tilt and telescopic,Steering wheel mounted controls: audio  cruise control, phone, voice control,Storage: accessory hook  door pockets, front seatback, in dash, sunglasses holder,Touch-sensitive controls: ,Vanity mirrors: dual illuminating,Infotainment: MAZDA CONNECT,Infotainment screen size: 7 in.,Hill holder control: ,Stability control: ,Traction control: ","","https://cdn.dealrimages.com/WN%2F7D%2FBX%2FW9TLCPGCOQKYO1.jpg?h=800,https://cdn.dealrimages.com/RB%2FOJ%2F04%2FOM8IHNIY9DF58A.jpg?h=800,https://cdn.dealrimages.com/6R%2FNC%2F7X%2FYWQK2GIA5YN6FH.jpg?h=800,https://cdn.dealrimages.com/2N%2FRN%2FOE%2FMZQ8YF7E0DWG24.jpg?h=800,https://cdn.dealrimages.com/2C%2FTO%2FM2%2FGQJNMQEMLIHSP6.jpg?h=800,https://cdn.dealrimages.com/NI%2FYW%2FNL%2FE2MHLTAAXUFPAQ.jpg?h=800,https://cdn.dealrimages.com/02%2FCO%2F0V%2FR3DYTZIO0GU1O6.jpg?h=800,https://cdn.dealrimages.com/3I%2F73%2FQD%2FX8ALDMRD06Y2ZG.jpg?h=800,https://cdn.dealrimages.com/7H%2FTK%2FJ6%2F08MGCPB0B20K6L.jpg?h=800,https://cdn.dealrimages.com/RT%2FX7%2FJG%2F9NO0KSBPBSOIQV.jpg?h=800,https://cdn.dealrimages.com/PC%2F06%2FZE%2F0UYKS2BIZ4E8LA.jpg?h=800,https://cdn.dealrimages.com/Q4%2FQP%2F0O%2FI1XOAJMZI11Y75.jpg?h=800,https://cdn.dealrimages.com/QO%2F1B%2FC7%2FZ29MOJP9LXY3YN.jpg?h=800,https://cdn.dealrimages.com/VY%2FUB%2FFF%2F6BQD92SJL159JE.jpg?h=800,https://cdn.dealrimages.com/KL%2F7K%2FYW%2F1B7BI02PWGDFGK.jpg?h=800,https://cdn.dealrimages.com/M4%2FAH%2F73%2FCHZS5JJG71QE0E.jpg?h=800,https://cdn.dealrimages.com/IR%2FOS%2F0S%2FW9K9G8A5H1UPRK.jpg?h=800,https://cdn.dealrimages.com/D0%2FT9%2FW5%2F3J57PG6DH3GJG6.jpg?h=800,https://cdn.dealrimages.com/41%2FLQ%2FDD%2F986VPLOZ86ANFH.jpg?h=800,https://cdn.dealrimages.com/Z9%2F32%2F1Z%2FI8UXAN7EXEWOFN.jpg?h=800,https://cdn.dealrimages.com/G2%2FPD%2F51%2FMPAMGTIQR6R6N5.jpg?h=800,https://cdn.dealrimages.com/5R%2FEX%2FQP%2FWNWX94DKSMAUD0.jpg?h=800,https://cdn.dealrimages.com/FV%2FMP%2FDR%2F05W7JXDVNQOZ0N.jpg?h=800,https://cdn.dealrimages.com/6F%2F1E%2FYU%2FJKJISA1L9TQE6J.jpg?h=800,https://cdn.dealrimages.com/19%2FYS%2FEZ%2F8VCOMU5JTOR6UI.jpg?h=800,https://cdn.dealrimages.com/09%2FGO%2F9D%2FFK1TW9P2L263NE.jpg?h=800,https://cdn.dealrimages.com/7C%2FKE%2FLD%2FCGLR5UJ5FBI7LN.jpg?h=800,https://cdn.dealrimages.com/ZD%2FGR%2FOF%2F7CC4PTD0G3L3KN.jpg?h=800,https://cdn.dealrimages.com/D6%2FP5%2FR9%2FNPZQKVM6AUFEOC.jpg?h=800,https://cdn.dealrimages.com/3Y%2FMT%2FNV%2FBN2M3R5YFE41YU.jpg?h=800,https://cdn.dealrimages.com/S1%2FQB%2F9W%2FFTBAHRC6X2VJR5.jpg?h=800,https://cdn.dealrimages.com/B5%2FHG%2FWC%2FLGG0FY3CLK73T3.jpg?h=800,https://cdn.dealrimages.com/NR%2F2V%2FUK%2F1YLU77C9AS13ED.jpg?h=800","1970-01-01T00:00:00+00:00","","2024-11-19","","","24","","https://www.premiummotors.com//viewInventory/830983/","","","830983","14778 E Broad St.","Reynoldsburg","OH","43068","(614) 412-3429","sales@premiummotors.com"
"451730","Premium Motors LLC","0","1G1BD5SM5J7120842","11791","2018","Chevrolet","Cruze","LT Manual","Car","","0","0","","7990","","","","","127641","","gas","Black","","Black","","Cloth","","4","1.4","4","fwd","6-Speed Manual","","Sunroof/Moonroof,Heated Seats,Bluetooth,Backup Camera,Driver seat manual adjustments: height  reclining, 6,Front headrests: adjustable  2,Front seat type: bucket,Passenger seat manual adjustments: reclining  2,Rear headrests: adjustable  2,Rear seat folding: split,Rear seat type: 60-40 split bench,Upholstery: cloth,ABS: 4-wheel,Electronic brakeforce distribution: ,Front brake diameter: 10.8,Front brake type: ventilated disc,Power brakes: ,Rear brake diameter: 10.4,Rear brake type: disc,Alternator: 130 amps,Battery: maintenance-free,Battery saver: ,Daytime running lights: LED,Front fog lights: ,Headlights: auto delay off  auto on/off, halogen,Camera system: rearview,Check rear seat reminder: ,Child safety door locks: ,Child seat anchors: LATCH system,Crumple zones: front  rear,Emergency interior trunk release: ,Programmable safety key: ,Rearview monitor: in dash,Airbag deactivation: occupant sensing passenger,Front airbags: dual,Knee airbags: dual front,Side airbags: front,Side curtain airbags: front  rear,Side mirror adjustments: manual folding  power,Side mirrors: heated,Front wipers: variable intermittent,Power windows: ,Solar-tinted glass: ,Window defogger: rear,Anti-theft system: alarm  vehicle immobilizer,Power door locks: anti-lockout,Front seatbelts: 3-point,Rear seatbelts: 3-point,Seatbelt pretensioners: front,Seatbelt warning sensor: front,Axle ratio: 3.65,Front shock type: gas,Front spring type: coil,Front stabilizer bar: ,Front struts: MacPherson,Front suspension classification: independent,Front suspension type: lower control arms,Rear shock type: gas,Rear spring type: coil,Rear suspension classification: semi-independent,Rear suspension type: torsion beam,Driver assistance app: roadside assistance,Electronic messaging assistance: voice operated  with read function,Satellite communications: OnStar  voice guided directions,Smart device app function: horn/light operation  lock operation, maintenance status,Wi-Fi: hotspot,Wireless data link: Bluetooth,Antenna type: diversity  mast,Auxiliary audio input: Bluetooth  USB, iPod/iPhone, jack,Internet radio app: Gracenote  Pandora, Stitcher,Radio: AM/FM  touch screen display, voice operated,Radio data system: ,Satellite radio: SiriusXM,Speed sensitive volume control: ,Total speakers: 6,Spare tire mount location: inside,Spare tire size: temporary,Spare wheel type: steel,Tire Pressure Monitoring System: ,Tire type: all season,Wheels: aluminum,Clock: ,Compass: ,Digital odometer: ,Fuel economy display: MPG  range,Gauge: oil pressure  tachometer,Instrument cluster screen size: 3.5 in.,Multi-function display: ,Trip odometer: ,Warnings and reminders: low fuel level  low oil level,Air filtration: ,Front air conditioning: ,Front air conditioning zones: single,Rear vents: second row,Armrests: rear center with cupholders  rear folding,Floor mat material: carpet,Floor material: carpet,Floor mats: front  rear,Shift knob trim: urethane,Steering wheel trim: urethane,Door handle color: body-color,Front bumper color: body-color,Grille color: black  chrome surround,Mirror color: body-color,Rear bumper color: body-color,Window trim: chrome,Assist handle: front  rear,Cargo area light: ,Center console: front console with armrest and storage  illuminated,Cruise control: ,Cupholders: front  rear,Multi-function remote: keyless entry  panic alarm, trunk release,One-touch windows: 2,Power outlet(s): 12V front,Power steering: ,Power windows: lockout button,Reading lights: front  rear,Rearview mirror: manual day/night,Steering wheel: tilt and telescopic,Steering wheel mounted controls: audio  cruise control, phone, voice control,Storage: accessory hook  door pockets, front seatback, in dash,Vanity mirrors: dual,Connected in-car apps: driving performance,Infotainment: MyLink,Infotainment screen size: 7 in.,Smartphone integration: Android Auto  Apple CarPlay,Stability control: ,Traction control: ","","https://cdn.dealrimages.com/E3%2FH6%2FW5%2F7R9IVY9DESHRMB.jpg?h=800,https://cdn.dealrimages.com/YC%2F80%2FV3%2FLF8LIQ2OL1VBDD.jpg?h=800,https://cdn.dealrimages.com/US%2F5D%2FPE%2FATH5SPG7F66G8S.jpg?h=800,https://cdn.dealrimages.com/NH%2FSH%2FDD%2FVKLOG5754C3I0J.jpg?h=800,https://cdn.dealrimages.com/7L%2F9U%2F21%2FKJ8ZURRZ9U4E6F.jpg?h=800,https://cdn.dealrimages.com/OD%2F12%2FQW%2FVZ68D18VZTQKY4.jpg?h=800,https://cdn.dealrimages.com/J4%2FKC%2FPB%2F76I5BW28NP9KPD.jpg?h=800,https://cdn.dealrimages.com/Y3%2FU6%2FRA%2FDAA5IVWRWNPON7.jpg?h=800,https://cdn.dealrimages.com/LU%2FMR%2FRE%2FXOKT8IKFNQBQBN.jpg?h=800,https://cdn.dealrimages.com/QI%2FHR%2FYL%2FY1Y6NYHKZT439R.jpg?h=800,https://cdn.dealrimages.com/6P%2F3I%2FAW%2FDDCH1RI9O3P8CT.jpg?h=800,https://cdn.dealrimages.com/GA%2FB8%2FYC%2FN8HWRNMZJ7PDLI.jpg?h=800,https://cdn.dealrimages.com/IE%2F4V%2F0N%2FZABTOOLHJ30AEQ.jpg?h=800,https://cdn.dealrimages.com/8M%2FU5%2FUP%2F8YF1T8XPGWLTVD.jpg?h=800,https://cdn.dealrimages.com/PT%2FZZ%2FMF%2FFX9K8362YEINKG.jpg?h=800,https://cdn.dealrimages.com/RX%2FN4%2F2F%2F50OOWEBO54R8AM.jpg?h=800,https://cdn.dealrimages.com/72%2F8E%2FAP%2FE6WUKHUYIFMDWP.jpg?h=800,https://cdn.dealrimages.com/MT%2F3D%2FO1%2F7YV7SCAOPFMB3T.jpg?h=800,https://cdn.dealrimages.com/MU%2FI4%2F2T%2FS65X26QZSV27X9.jpg?h=800,https://cdn.dealrimages.com/64%2F1F%2F6Z%2FKQ3ULV0T8UBA1A.jpg?h=800,https://cdn.dealrimages.com/5M%2FPZ%2F8C%2FTQV09Y54QWLLPI.jpg?h=800,https://cdn.dealrimages.com/9D%2FKV%2FL6%2FSJJJ4I6Z6M8YZG.jpg?h=800,https://cdn.dealrimages.com/0L%2F9O%2F2J%2F50XOPSZ6648LSP.jpg?h=800,https://cdn.dealrimages.com/YQ%2FTD%2FGK%2F1QFQM9K562ZDZZ.jpg?h=800,https://cdn.dealrimages.com/AO%2F02%2FPB%2FT09IL49IB6VVR2.jpg?h=800,https://cdn.dealrimages.com/73%2F6C%2F69%2FSNW9W7GK5X2XTC.jpg?h=800,https://cdn.dealrimages.com/WA%2FNG%2FL9%2FHSBCF0Y7UBFSCY.jpg?h=800,https://cdn.dealrimages.com/TG%2FRT%2F65%2FVP9IBVFBTSJGSP.jpg?h=800,https://cdn.dealrimages.com/QP%2F21%2FP2%2FVJTCJJZB8UBKZD.jpg?h=800,https://cdn.dealrimages.com/34%2FCH%2FDO%2FSWZQXSPHBTDWRF.jpg?h=800,https://cdn.dealrimages.com/C7%2FW0%2FUN%2FBOL7M2UK20JPHM.jpg?h=800,https://cdn.dealrimages.com/CD%2FYF%2F0Q%2FOUI30KOJG8I1MX.jpg?h=800,https://cdn.dealrimages.com/YG%2FBV%2FF5%2FLWMAER7KV23T74.jpg?h=800,https://cdn.dealrimages.com/MI%2F2M%2F4Y%2FWHVIO758YL8P9O.jpg?h=800,https://cdn.dealrimages.com/86%2FCH%2F78%2FQS39JUP79LLMC7.jpg?h=800,https://cdn.dealrimages.com/3N%2FKG%2FP0%2F1RBUHKMK9Z39WM.jpg?h=800","1970-01-01T00:00:00+00:00","","2024-09-24","","","27","","https://www.premiummotors.com//viewInventory/808934/","","","808934","14778 E Broad St.","Reynoldsburg","OH","43068","(614) 412-3429","sales@premiummotors.com"
"451730","Premium Motors LLC","0","5TDZA3EH1BS007625","11834","2011","Toyota","Highlander","SE","SUV","","0","0","","6490","","","","","209095","","gas","Black","","Gray","","Leather","","4","2.7","4","fwd","6-Speed Shiftable Automatic","","Leather Seats,Heated Seats,Bluetooth,Backup Camera,Moonroof / Sunroof: power  sliding sunshade, tilt,Roof rails: black,Liftgate window: manual flip-up,Rear door type: power liftgate,Driver seat: heated,Driver seat power adjustments: 8,Front headrests: adjustable  2,Passenger seat: heated,Passenger seat manual adjustments: 4,Rear headrests: adjustable  3,Rear seat folding: flat,Rear seat manual adjustments: reclining,Rear seat type: 40-20-40 split bench,Third row headrests: adjustable  2,Third row seat folding: fold flat into floor  split,Third row seat type: 50-50 split bench,Third row seat upholstery: vinyl,Upholstery: leather-trimmed,ABS: 4-wheel,Electronic brakeforce distribution: ,Front brake diameter: 12.9,Front brake type: ventilated disc,Rear brake diameter: 12.2,Rear brake type: disc,Daytime running lights: ,Front fog lights: ,Headlights: auto delay off,Taillights: LED,Active head restraints: dual front,Body side reinforcements: side impact door beams,Camera system: rearview,Child safety door locks: ,Child seat anchors: LATCH system,Crumple zones: front  rear,Energy absorbing steering column: ,Impact sensor: fuel cut-off,Rearview monitor: in dash,Airbag deactivation: occupant sensing passenger,Front airbags: dual,Knee airbags: driver,Side airbags: front,Side curtain airbags: front  rear, third row,Side-curtain airbag rollover sensor: ,Side mirror adjustments: manual folding  power,Power windows: safety reverse,Rear privacy glass: ,Window defogger: rear,Anti-theft system: engine immobilizer,Power door locks: auto-locking,Steering ratio: 17.1,Turns lock-to-lock: 3.1,Front seatbelts: 3-point,Rear seatbelts: 3-point,Seatbelt warning sensor: front,Axle ratio: 4.35,Front shock type: gas,Front spring type: coil,Front stabilizer bar: diameter 27 mm,Front struts: MacPherson,Front suspension classification: independent,Front suspension type: lower control arms,Rear shock type: gas,Rear spring type: coil,Rear stabilizer bar: diameter 14 mm,Rear struts: ,Rear suspension classification: independent,Rear suspension type: multi-link,Phone: hands free,Wireless data link: Bluetooth,Antenna type: element,Auxiliary audio input: USB  iPod/iPhone, jack,In-Dash CD: MP3 Playback  single disc,Radio: AM/FM,Satellite radio: SiriusXM,Speed sensitive volume control: ,Total speakers: 6,Spare tire mount location: inside,Spare tire size: full-size,Spare wheel type: steel,Tire Pressure Monitoring System: ,Tire type: all season,Wheel spokes: 7,Wheels: aluminum,Clock: ,External temperature display: ,Warnings and reminders: coolant temperature warning  lamp failure, low fuel level, low oil pressure, maintenance due, tire fill alert,Front air conditioning: ,Front air conditioning zones: single,Rear vents: second row  third row,Shift knob trim: leather,Steering wheel trim: leather,Door handle color: body-color,Front bumper color: body-color,Grille color: chrome accents  silver,Mirror color: body-color,Rear bumper color: body-color,Rear spoiler: roofline,Rear spoiler color: body-color,Rocker panel color: black  chrome accents,Cargo cover: ,Center console: front console with storage,Conversation mirror: ,Cruise control: ,Cupholders: front  rear, third row,Easy entry: manual rear seat,Multi-function remote: fuel filler door release  keyless entry,One-touch windows: 1,Overhead console: front,Power outlet(s): 12V cargo area  two 12V front,Reading lights: front  rear,Rearview mirror: auto-dimming,Steering wheel: tilt and telescopic,Steering wheel mounted controls: audio  multi-function, phone,Storage: cargo tie-down anchors and hooks  door pockets, front seatback, in floor, sunglasses holder,Universal remote transmitter: Homelink - garage door opener,Vanity mirrors: dual illuminating,Hill holder control: ,Stability control: ,Traction control: ","","https://cdn.dealrimages.com/JI%2FF0%2FFL%2FCGLZV9JA8V5YZ3.jpg?h=800,https://cdn.dealrimages.com/MV%2F0X%2FJI%2FTUR086Y3SFEPM6.jpg?h=800,https://cdn.dealrimages.com/ZE%2F5K%2FDN%2FW4XEFIO2068HNS.jpg?h=800,https://cdn.dealrimages.com/YA%2F1U%2F9I%2FF5K7BBUJWGOEGH.jpg?h=800,https://cdn.dealrimages.com/E3%2FTJ%2FIG%2FWW1DJ59VYBJG3Y.jpg?h=800,https://cdn.dealrimages.com/BF%2FF6%2F8P%2F9SCA0FEGA2806G.jpg?h=800,https://cdn.dealrimages.com/XY%2FMV%2FCZ%2F88TA9C2EWOOVVZ.jpg?h=800,https://cdn.dealrimages.com/N4%2F1E%2F9K%2FFUUBJK3TOZ3FXA.jpg?h=800,https://cdn.dealrimages.com/CK%2FW1%2FUU%2FNMM2YY5D6E0LPS.jpg?h=800,https://cdn.dealrimages.com/27%2F9Z%2FBS%2FSEHPFYFN82WEU6.jpg?h=800,https://cdn.dealrimages.com/F7%2F24%2FQG%2FGB2KOF3O144OXX.jpg?h=800,https://cdn.dealrimages.com/DK%2FH6%2F19%2FDA4J2W6DNL5Z85.jpg?h=800,https://cdn.dealrimages.com/H8%2F3J%2FQV%2FSR0S7QY1O2QWHD.jpg?h=800,https://cdn.dealrimages.com/1R%2FM8%2F8W%2FMES9HZIE1R44LG.jpg?h=800,https://cdn.dealrimages.com/IP%2FMK%2FMQ%2FXSBFNRDEWOVE67.jpg?h=800,https://cdn.dealrimages.com/ON%2F18%2FX0%2F5EYKF8IJBVF5VC.jpg?h=800,https://cdn.dealrimages.com/F7%2F2E%2F0G%2FCIE8GNMZPAJ4PD.jpg?h=800,https://cdn.dealrimages.com/JP%2FWN%2F2V%2FQZGZZ6CYV6YLKW.jpg?h=800,https://cdn.dealrimages.com/BE%2FTU%2F1C%2FEBG8XY88LUK00T.jpg?h=800,https://cdn.dealrimages.com/H1%2FZ2%2FAU%2FNC54EHJQKVYYFK.jpg?h=800,https://cdn.dealrimages.com/NX%2FIJ%2FCX%2FEJC7CGDNUWKW5Z.jpg?h=800,https://cdn.dealrimages.com/FC%2FH1%2F44%2FQW6HT0P570LXGW.jpg?h=800,https://cdn.dealrimages.com/L6%2F8J%2F8V%2FLTEVW2U2MRW5J9.jpg?h=800,https://cdn.dealrimages.com/WK%2FX8%2FZ4%2F0VG4B60TJJOHZJ.jpg?h=800,https://cdn.dealrimages.com/7A%2FCF%2F5U%2FEACQ4NJLNSIHDU.jpg?h=800,https://cdn.dealrimages.com/D2%2FWS%2FK3%2FNLQ4CZZF3CXCK5.jpg?h=800,https://cdn.dealrimages.com/RE%2FWQ%2FQ2%2F8IYGDHQJL1W8UZ.jpg?h=800,https://cdn.dealrimages.com/0T%2FIM%2F7A%2FDPQW7LTM2DO6FS.jpg?h=800,https://cdn.dealrimages.com/E6%2F8H%2FK0%2F0B57VDJL1IBUQ3.jpg?h=800,https://cdn.dealrimages.com/X1%2FCJ%2F8H%2FQORRBR5OK8MZAM.jpg?h=800,https://cdn.dealrimages.com/1D%2FKM%2FVL%2FMW6JC9C60VRC2S.jpg?h=800,https://cdn.dealrimages.com/MA%2FGT%2FUV%2FA0UO4EZ6PD4GK3.jpg?h=800,https://cdn.dealrimages.com/FO%2FBD%2FW0%2FBOI63LKG1HIV88.jpg?h=800,https://cdn.dealrimages.com/OH%2FRF%2FJS%2FDQFJTHL1H3QKDV.jpg?h=800","1970-01-01T00:00:00+00:00","","2024-12-13","","","20","","https://www.premiummotors.com//viewInventory/840685/","","","840685","14778 E Broad St.","Reynoldsburg","OH","43068","(614) 412-3429","sales@premiummotors.com"
